date,url,title,source,category
2026-07-09,https://arxiv.org/abs/2606.19084,Optimal score function estimation via derivatives constraints,arxiv,stat
2026-07-09,https://arxiv.org/abs/2607.06570,Value of Information under Imprecise Probabilities: Decision-Rule-Specific Values and Fixed-Measure Envelopes on a Credal Set,arxiv,stat
2026-07-09,https://arxiv.org/abs/2607.06605,"A Quiet Failure in Calibrated Virtual Screening: Marginal Conformal Prediction Under-Covers the Minority Class, and a Class-Conditional Fix Recovers It",arxiv,stat
2026-07-09,https://arxiv.org/abs/2607.06637,Optimized Instance Alteration for Explaining and Assessing Robustness of Classifiers,arxiv,stat
2026-07-09,https://arxiv.org/abs/2607.06644,Fast determinantal sampling on general spaces and diffusion geometry,arxiv,stat
2026-07-09,https://arxiv.org/abs/2607.06652,From Jumps to Signatures: a Generative Method for Temporal Point Processes,arxiv,stat
2026-07-09,https://arxiv.org/abs/2607.06690,tsbootstrap: Distribution-Free Uncertainty Quantification and Conformal Prediction for Time Series,arxiv,stat
2026-07-09,https://arxiv.org/abs/2607.06696,Heat-Kernel Entropy Profiles and Geometric Effective Sample Size for Weighted Measures on Manifolds,arxiv,stat
2026-07-09,https://arxiv.org/abs/2607.06722,Modality Analysis via Spacing with the Dimodal Software Libraries,arxiv,stat
2026-07-09,https://arxiv.org/abs/2607.06776,Efficient Bayesian Deep Ensembles via Analytic Predictive Inference,arxiv,stat
2026-07-09,https://arxiv.org/abs/2607.06790,A generalized angular regression model with a circular random intercept and a scalar random slope,arxiv,stat
2026-07-09,https://arxiv.org/abs/2607.06797,MAPLE: Mapper Based Localized Prediction with Data Driven Cover Selection for High dimensional Data,arxiv,stat
2026-07-09,https://arxiv.org/abs/2607.06832,When is multivariate kriging worthwhile? A design-geometry analysis of heterotopic multi-output Gaussian processes,arxiv,stat
2026-07-09,https://arxiv.org/abs/2607.06841,Tensor Train Diffusion: Leveraging Low-Rank Structures for High-Dimensional Score-Based Sampling,arxiv,stat
2026-07-09,https://arxiv.org/abs/2607.06879,Best-Arm Identification with Generative Proxy,arxiv,stat
2026-07-09,https://arxiv.org/abs/2607.06883,Finding a stationary point of a stochastic convex problem,arxiv,stat
2026-07-09,https://arxiv.org/abs/2607.06912,Causal Inference for Case Studies in Behavioral Health,arxiv,stat
2026-07-09,https://arxiv.org/abs/2607.06936,Transfer Learning for Linear Discriminant Analysis with a Shared Classification Signal,arxiv,stat
2026-07-09,https://arxiv.org/abs/2607.06939,Compensator-based inference for signal detection under unknown background: the binned data case,arxiv,stat
2026-07-09,https://arxiv.org/abs/2607.07008,Tensorized algorithms and scalable filtering methods for hidden Markov and factorial hidden Markov models,arxiv,stat
2026-07-09,https://arxiv.org/abs/2607.07014,Local large deviations for linear-region growth in random piecewise-linear networks,arxiv,stat
2026-07-09,https://arxiv.org/abs/2607.07032,Gauge-Invariant Learnable Spectral Positional Encodings for Directed Graphs via Hermitian Block Krylov Subspaces,arxiv,stat
2026-07-09,https://arxiv.org/abs/2607.07065,Which Regularized Propensity-Score and Doubly Robust Methods Are Best Calibrated When Exposures or Outcomes Are Rare? A Plasmode Study of Proxy-Based Confounding Adjustment,arxiv,stat
2026-07-09,https://arxiv.org/abs/2607.07141,From Text to Parameters: Predicting Item Parameters from Embedding Regularization with Reliability and Design Ceilings,arxiv,stat
2026-07-09,https://arxiv.org/abs/2607.07159,Recovering Latent Structures after Variational Bayesian Variable Selection: Fit Assessment and Factor-Number Selection in Partially Exploratory Factor Analysis,arxiv,stat
2026-07-09,https://arxiv.org/abs/2607.07215,Robust Indicators of Spatial Association,arxiv,stat
2026-07-09,https://arxiv.org/abs/2607.07232,DiPhon: Diffusion on Graphons for Scalable Graph Generation,arxiv,stat
2026-07-09,https://arxiv.org/abs/2607.07247,Comparing Imputation Methods for Clinical Prediction Model Development under Complex Missingness Scenarios: A Simulation Study Using Real-World Cardiac Data,arxiv,stat
2026-07-09,https://arxiv.org/abs/2607.07284,Visualizing and forecasting subnational life-table death counts: Gap forecasting methods,arxiv,stat
2026-07-09,https://arxiv.org/abs/2607.07286,From Statistical to Structural Synergy: A Predictability Framework to Quantify the Effects due to High-Order Mechanisms,arxiv,stat
2026-07-09,https://arxiv.org/abs/2607.07423,The Optimal Sample Complexity of Learning Autoregressive Chain-of-Thought,arxiv,stat
2026-07-09,https://arxiv.org/abs/2607.07464,Infinite hidden Markov models for cylindrical data,arxiv,stat
2026-07-09,https://arxiv.org/abs/2607.07468,Statistical inverse learning and $\ell^1$-regularization,arxiv,stat
2026-07-09,https://arxiv.org/abs/2607.07509,Adjusting for Outcome Reporting Bias in Meta-analysis: A Multiple Imputation Approach,arxiv,stat
2026-07-09,https://arxiv.org/abs/2607.07513,Fast Rates for Semi-Supervised Learning via Data-Augmentation Graph Regularization,arxiv,stat
2026-07-09,https://arxiv.org/abs/2607.07527,A Unified Detection Framework for AI-Related Content and Artifacts,arxiv,stat
2026-07-09,https://arxiv.org/abs/2607.07538,Avoiding unsafe sets when training with Langevin Dynamics,arxiv,stat
2026-07-09,https://arxiv.org/abs/2607.07543,"Equivalence testing in pesticide risk assessment -- Evaluation and practical guidance for design, analysis and interpretation",arxiv,stat
2026-07-09,https://arxiv.org/abs/2607.07588,Tasting the equality of estimable parameters,arxiv,stat
2026-07-09,https://arxiv.org/abs/2607.07699,Mitigating the Winner's Curse While Controlling Multiplicity: e-Process Methods for Anytime-Valid Inference in Dose-Ranging Trials,arxiv,stat
2026-07-09,https://arxiv.org/abs/2204.08476,Research on Domain Information Mining and Theme Evolution of Scientific Papers,arxiv,cs
2026-07-09,https://arxiv.org/abs/2211.14966,Adversarial Rademacher Complexity of Deep Neural Networks,arxiv,cs
2026-07-09,https://arxiv.org/abs/2304.03388,InferNet: Exploiting Aggregate GPU Profiles as Side-Channel for DNN Architecture Inference,arxiv,cs
2026-07-09,https://arxiv.org/abs/2306.12859,Reinforcement Federated Learning Method Based on Adaptive OPTICS Clustering,arxiv,cs
2026-07-09,https://arxiv.org/abs/2308.13380,From system models to class models: An in-context learning paradigm,arxiv,cs
2026-07-09,https://arxiv.org/abs/2402.01811,A Distributionally Robust Optimisation Approach to Fair Credit Scoring,arxiv,cs
2026-07-09,https://arxiv.org/abs/2404.13879,Lipschitz-Regularized Critics Lead to Policy Robustness Against Transition Dynamics Uncertainty,arxiv,cs
2026-07-09,https://arxiv.org/abs/2405.16668,Provably Efficient Off-Policy Adversarial Imitation Learning with Convergence Guarantees,arxiv,cs
2026-07-09,https://arxiv.org/abs/2407.11217,Faster and Simpler Greedy Algorithm for $k$-Median and $k$-Means,arxiv,cs
2026-07-09,https://arxiv.org/abs/2410.07719,How Learning Dynamics Drive Adversarially Robust Generalization?,arxiv,cs
2026-07-09,https://arxiv.org/abs/2411.17077,ContrastiveCFG: Guiding Diffusion Sampling by Contrasting Positive and Negative Concepts,arxiv,cs
2026-07-09,https://arxiv.org/abs/2412.03405,Deep Operator BSDE: a Numerical Scheme to Approximate Solution Operators,arxiv,cs
2026-07-09,https://arxiv.org/abs/2501.18784,Successor-Generator Planning with LLM-generated Heuristics,arxiv,cs
2026-07-09,https://arxiv.org/abs/2502.00037,Superstate Quantum Mechanics,arxiv,cs
2026-07-09,https://arxiv.org/abs/2503.15581,PB-OEL: A Performance-Bounded Online Ensemble Learning Framework With Mixed Feedback for Real-Time Safety Assessment,arxiv,cs
2026-07-09,https://arxiv.org/abs/2504.01894,Bifidelity Parameter Estimation Using Conditional Diffusion Models,arxiv,cs
2026-07-09,https://arxiv.org/abs/2504.08430,A Hybrid ABM-PDE Framework for Real-World Infectious Disease Simulations,arxiv,cs
2026-07-09,https://arxiv.org/abs/2505.01584,Silent Neuron Theory and Plasticity Preservation for Deep Reinforcement Learning in Adaptive Video Streaming,arxiv,cs
2026-07-09,https://arxiv.org/abs/2506.01260,Protocol Models: Scaling Decentralized Training with Communication-Efficient Model Parallelism,arxiv,cs
2026-07-09,https://arxiv.org/abs/2506.04985,FPTQuant: Function-Preserving Transforms for LLM Quantization,arxiv,cs
2026-07-09,https://arxiv.org/abs/2506.08630,Shared Modular Recurrence in Contextual MDPs for Universal Morphology Control,arxiv,cs
2026-07-09,https://arxiv.org/abs/2507.05116,VOTE: Vision-Language-Action Optimization with Trajectory Ensemble Voting,arxiv,cs
2026-07-09,https://arxiv.org/abs/2507.14159,Siamese Neural Network for Label-Efficient Critical Phenomena Prediction in 3D Percolation Models,arxiv,cs
2026-07-09,https://arxiv.org/abs/2507.14177,Understanding Two-Layer Neural Networks with Smooth Activation Functions,arxiv,cs
2026-07-09,https://arxiv.org/abs/2507.23615,L-GTA: Latent Generative Modeling for Time Series Augmentation,arxiv,cs
2026-07-09,https://arxiv.org/abs/2508.10956,A Study of Commonsense Reasoning over Visual Object Properties,arxiv,cs
2026-07-09,https://arxiv.org/abs/2508.16943,LHM-Humanoid: Long-Horizon Human Motion Control for Continuous Object Transport in Cluttered Scenes,arxiv,cs
2026-07-09,https://arxiv.org/abs/2508.17298,Explain Before You Answer: A Survey on Compositional Visual Reasoning,arxiv,cs
2026-07-09,https://arxiv.org/abs/2510.02999,NonTextual Target Attack,arxiv,cs
2026-07-09,https://arxiv.org/abs/2510.04547,Activation Quantization of Vision Encoders Needs Prefixing Registers,arxiv,cs
2026-07-09,https://arxiv.org/abs/2510.04758,Provable Affine Identifiability of Nonlinear CCA under Latent Distributional Priors,arxiv,cs
2026-07-09,https://arxiv.org/abs/2510.09595,LiveOIBench: Can Large Language Models Outperform Human Contestants in Informatics Olympiads?,arxiv,cs
2026-07-09,https://arxiv.org/abs/2510.13817,What's on My Network? Using Large Language Models to Identify Real-World IoT Devices at Scale,arxiv,cs
2026-07-09,https://arxiv.org/abs/2510.24108,Zero-Human Demonstration End-to-end Autonomous Driving with Trajectory Scorer,arxiv,cs
2026-07-09,https://arxiv.org/abs/2511.06667,Rapidly Learning Soft Robot Control via Implicit Time-Stepping,arxiv,cs
2026-07-09,https://arxiv.org/abs/2511.13726,Refine Thought: A Test-Time Inference Method for Embedding Model Reasoning,arxiv,cs
2026-07-09,https://arxiv.org/abs/2511.16107,T2T-VICL: Cross-Task Visual In-Context Learning via Implicit Text-Driven VLMs,arxiv,cs
2026-07-09,https://arxiv.org/abs/2511.18735,Thinking Ahead: Foresight Intelligence in MLLMs and World Model,arxiv,cs
2026-07-09,https://arxiv.org/abs/2511.23347,Distributed Dynamic Associative Memory via Online Convex Optimization,arxiv,cs
2026-07-09,https://arxiv.org/abs/2512.02076,FDRMFL: Multimodal Federated Feature Extraction Model Based on Information Maximization and Contrastive Learning,arxiv,cs
2026-07-09,https://arxiv.org/abs/2512.05693,HiMoE-VLA: Hierarchical Mixture-of-Experts for Generalist Vision-Language-Action Policies,arxiv,cs
2026-07-09,https://arxiv.org/abs/2512.11935,AGAPI-Agents: An Open-Access Agentic AI Platform for Accelerated Materials Design on AtomGPT.org,arxiv,cs
2026-07-09,https://arxiv.org/abs/2601.06135,Attention in Geometry: Scalable Spatial Modeling via Adaptive Density Fields and FAISS-Accelerated Kernels,arxiv,cs
2026-07-09,https://arxiv.org/abs/2601.06363,The Replicator-Optimization Mechanism: A Scale-Relative Formalism for Persistence-Conditioned Dynamics with Application to Consent-Based Metaethics,arxiv,cs
2026-07-09,https://arxiv.org/abs/2601.06425,HiDVFS: Hierarchical Multi-Agent DVFS for Real-Time OpenMP DAG Workloads,arxiv,cs
2026-07-09,https://arxiv.org/abs/2601.13563,ButterflyMoE: Compression-Scalable Ternary Experts via Structured Butterfly Orbits,arxiv,cs
2026-07-09,https://arxiv.org/abs/2601.14271,Neutral Substrates: A Design Constraint for Shared Records Under Persistent Interpretive Disagreement,arxiv,cs
2026-07-09,https://arxiv.org/abs/2601.14590,Counterfactual Modeling with Fine-Tuned LLMs for Health Intervention Design and Sensor Data Augmentation,arxiv,cs
2026-07-09,https://arxiv.org/abs/2601.16529,SycoEval-EM: Sycophancy Evaluation of Large Language Models in Simulated Clinical Encounters for Emergency Care,arxiv,cs
2026-07-09,https://arxiv.org/abs/2601.17216,Spatiotemporal Semantic V2X Framework for Cooperative Collision Prediction,arxiv,cs
2026-07-09,https://arxiv.org/abs/2601.20226,Parametric and Generative Forecasts of EPEX Day\char45 Ahead Energy Market Curves,arxiv,cs
2026-07-09,https://arxiv.org/abs/2601.21433,Framing Instability in LLM Ethical Stance: Auditing Negation Sensitivity in Moral Dilemmas,arxiv,cs
2026-07-09,https://arxiv.org/abs/2601.22879,Synthetic Time Series Generation via Complex Networks,arxiv,cs
2026-07-09,https://arxiv.org/abs/2602.02712,Towards Understanding Steering Strength,arxiv,cs
2026-07-09,https://arxiv.org/abs/2602.05088,AI Chatbot Suicide Risk Detection and Response: Human Validation Study of the Open-Source VERA-MH Safety Evaluation,arxiv,cs
2026-07-09,https://arxiv.org/abs/2602.06838,An Adaptive Differentially Private Federated Learning Framework,arxiv,cs
2026-07-09,https://arxiv.org/abs/2602.08923,DynamiQ: Accelerating Gradient Synchronization using Compressed Multi-hop All-reduce,arxiv,cs
2026-07-09,https://arxiv.org/abs/2602.10751,Predicting integers from continuous parameters,arxiv,cs
2026-07-09,https://arxiv.org/abs/2602.11399,Can We Really Learn One Representation to Optimize All Rewards?,arxiv,cs
2026-07-09,https://arxiv.org/abs/2602.12323,The Appeal and Reality of Recycling LoRAs with Adaptive Merging,arxiv,cs
2026-07-09,https://arxiv.org/abs/2602.18164,GrandTour: A Legged Robotics Dataset in the Wild for Multi-Modal Perception and State Estimation,arxiv,cs
2026-07-09,https://arxiv.org/abs/2602.18201,SOMtime the World Ain$'$t Fair: Violating Fairness Using Self-Organizing Maps,arxiv,cs
2026-07-09,https://arxiv.org/abs/2602.21556,Power and Limitations of Aggregation in Compound AI Systems,arxiv,cs
2026-07-09,https://arxiv.org/abs/2602.23128,Bound to Disagree: Generalization Bounds via Certifiable Surrogates,arxiv,cs
2026-07-09,https://arxiv.org/abs/2602.23802,EMO-R3: Reflective Reinforcement Learning for Emotional Reasoning in Multimodal Large Language Models,arxiv,cs
2026-07-09,https://arxiv.org/abs/2603.00233,Scaling Quantum Machine Learning without Tricks: Full-Resolution and Diverse Image Generation,arxiv,cs
2026-07-09,https://arxiv.org/abs/2603.01730,Decentralized Federated Learning by Partial Message Exchange,arxiv,cs
2026-07-09,https://arxiv.org/abs/2603.02150,Named-Entity Recognition in the Crime Domain (CrimeNER): Case Study and Dataset,arxiv,cs
2026-07-09,https://arxiv.org/abs/2603.04249,RoboLight: A Dataset with Linearly Composable Illumination for Robotic Manipulation,arxiv,cs
2026-07-09,https://arxiv.org/abs/2603.05296,Latent Policy Steering through One-Step Flow Policies,arxiv,cs
2026-07-09,https://arxiv.org/abs/2603.11756,Anomaly detection in time-series via inductive biases in the latent space of conditional normalizing flows,arxiv,cs
2026-07-09,https://arxiv.org/abs/2603.15685,DASH: Dynamic Audio-Driven Semantic Chunking for Efficient Omnimodal Token Compression,arxiv,cs
2026-07-09,https://arxiv.org/abs/2603.16551,CompDiff: Hierarchical Compositional Diffusion for Fair and Zero-Shot Intersectional Medical Image Generation,arxiv,cs
2026-07-09,https://arxiv.org/abs/2603.17057,Optimization-Embedded Active Multi-Fidelity Surrogate Learning for Multi-Condition Airfoil Shape Optimization,arxiv,cs
2026-07-09,https://arxiv.org/abs/2603.19742,Dual Path Attribution: Efficient Attribution for SwiGLU-Transformers through Layer-Wise Target Propagation,arxiv,cs
2026-07-09,https://arxiv.org/abs/2603.21489,Effective Strategies for Asynchronous Software Engineering Agents,arxiv,cs
2026-07-09,https://arxiv.org/abs/2603.23800,Object Search in Partially-Known Environments via LLM-informed Model-based Planning and Prompt Selection,arxiv,cs
2026-07-09,https://arxiv.org/abs/2603.26772,From Content to Audience: A Multimodal Annotation Framework for Broadcast Television Analytics,arxiv,cs
2026-07-09,https://arxiv.org/abs/2603.29693,Measuring the metacognition of AI,arxiv,cs
2026-07-09,https://arxiv.org/abs/2604.00533,Toward Robust Open-set Adaptation: Synapse Consolidation Inspired by Rac1/MAPK Pathways,arxiv,cs
2026-07-09,https://arxiv.org/abs/2604.01577,"Exploration of Fast-Slow Latent Recurrence for Train-Short, Test-Long Generalization",arxiv,cs
2026-07-09,https://arxiv.org/abs/2604.07392,Event-Centric World Modeling with Memory-Augmented Retrieval for Embodied Decision-Making,arxiv,cs
2026-07-09,https://arxiv.org/abs/2604.09320,Transferable FB-GNN-MBE Framework for Potential Energy Surfaces: Data-Adaptive Transfer Learning in Deep Learned Many-Body Expansion Theory,arxiv,cs
2026-07-09,https://arxiv.org/abs/2604.09558,VTC: DNN Compilation with Virtual Tensors for Data Movement Elimination,arxiv,cs
2026-07-09,https://arxiv.org/abs/2604.11840,Diversity Without Fidelity: A Solver-Sampler Mismatch in Multi-Agent LLM Negotiation Simulation,arxiv,cs
2026-07-09,https://arxiv.org/abs/2604.11950,AnyPoC: Universal Proof-of-Concept Test Generation for Scalable LLM-Based Bug Detection,arxiv,cs
2026-07-09,https://arxiv.org/abs/2604.14208,ML-based approach to classification and generation of structured light propagation in turbulent media,arxiv,cs
2026-07-09,https://arxiv.org/abs/2604.20711,Participatory provenance as representational auditing for AI-mediated public consultation,arxiv,cs
2026-07-09,https://arxiv.org/abs/2604.25605,Health System Scale Semantic Search Across Unstructured Clinical Notes,arxiv,cs
2026-07-09,https://arxiv.org/abs/2605.03195,Terminus-4B: Can a Smaller Model Replace Frontier LLMs at Agentic Execution Tasks?,arxiv,cs
2026-07-09,https://arxiv.org/abs/2605.03452,BifrostUMI: Bridging Robot-Free Demonstrations and Humanoid Whole-Body Manipulation,arxiv,cs
2026-07-09,https://arxiv.org/abs/2605.04724,From Beats to Breaches:How Offensive AI Infers Sensitive User Information from Playlists,arxiv,cs
2026-07-09,https://arxiv.org/abs/2605.08332,Optimal FALQON for Quantum Approximate Optimization via Layer-wise Parameter Tuning,arxiv,cs
2026-07-09,https://arxiv.org/abs/2605.08843,M$^3$: Reframing Training Measures for Discretized Physical Simulations,arxiv,cs
2026-07-09,https://arxiv.org/abs/2605.09778,Nectar: Neural Estimation of Cached-Token Attention via Regression,arxiv,cs
2026-07-09,https://arxiv.org/abs/2605.10240,MARGIN: Margin-Aware Regularized Geometry for Imbalanced Vulnerability Detection,arxiv,cs
2026-07-09,https://arxiv.org/abs/2605.11325,Structured Belief State and the First Precision-Aware Benchmark for LLM Memory Retrieval,arxiv,cs
2026-07-09,https://arxiv.org/abs/2605.15207,TeamTR: Trust-Region Fine-Tuning for Multi-Agent LLM Coordination,arxiv,cs
2026-07-09,https://arxiv.org/abs/2605.17842,SNLP: Layer-Parallel Inference via Structured Newton Corrections,arxiv,cs
2026-07-09,https://arxiv.org/abs/2605.19813,A Van Trees Lower Bound for Fully Interactive Differentially Private Federated Learning,arxiv,cs
2026-07-09,https://arxiv.org/abs/2605.19887,DAG-Based QoS-Aware Dynamic Task Placement for Networked Multi-Stage Control Pipelines,arxiv,cs
2026-07-09,https://arxiv.org/abs/2605.21133,Humanoid Whole-Body Manipulation via Active Spatial Brain and Generalizable Action Cerebellum,arxiv,cs
2026-07-09,https://arxiv.org/abs/2605.22774,CogAdapt: Adapting Clinical ECG Foundation Models for Wearable Cognitive Load Assessment,arxiv,cs
2026-07-09,https://arxiv.org/abs/2605.27000,Cast a Wider Net: Coordinated Pass@K Policy Optimization for Code Reasoning,arxiv,cs
2026-07-09,https://arxiv.org/abs/2605.27395,Informing AI Policy Assessment using Large-Scale Simulation of Interventions,arxiv,cs
2026-07-09,https://arxiv.org/abs/2605.29693,Momentum Based Reward Design for Low Emission Traffic Signal Control,arxiv,cs
2026-07-09,https://arxiv.org/abs/2605.30170,Unveiling the Visual Counting Bottleneck in Vision-Language Models,arxiv,cs
2026-07-09,https://arxiv.org/abs/2606.02912,Data-Driven Forecasting of three-Component Seismograms Using Transformer Architectures,arxiv,cs
2026-07-09,https://arxiv.org/abs/2606.03800,Trading Human Curation for Synthetic Augmentation in RLVR,arxiv,cs
2026-07-09,https://arxiv.org/abs/2606.03834,Let the Dynamics Flow: Stable Flow Matching Dynamical Systems,arxiv,cs
2026-07-09,https://arxiv.org/abs/2606.05403,"Trust, but Don't Verify: Epistemic Blind Spots in LLM Source Evaluation",arxiv,cs
2026-07-09,https://arxiv.org/abs/2606.06133,TLA-Prover: Verifiable TLA+ Specification Synthesis via Preference-Optimized Low-Rank Adaptation,arxiv,cs
2026-07-09,https://arxiv.org/abs/2606.07094,MetaConfigurator: AI-Assisted RDF Authoring from JSON Data,arxiv,cs
2026-07-09,https://arxiv.org/abs/2606.08068,DICE: Entropy-Regularized Equilibrium Selection for Stable Multi-Agent LLM Coordination,arxiv,cs
2026-07-09,https://arxiv.org/abs/2606.12629,The Signs Were Always There: Training-Free Concept Detection and Steering in Raw Transformer Dimensions,arxiv,cs
2026-07-09,https://arxiv.org/abs/2606.15346,DYNA-PRUNER: Input-Adaptive Data-Model Co-Pruning for Efficient and Scalable Spatio-Temporal Media Prediction,arxiv,cs
2026-07-09,https://arxiv.org/abs/2606.17420,"Feynman Kac Reweighted Schr\""odinger Bridge Matching for Surface-Based Tau PET Harmonization",arxiv,cs
2026-07-09,https://arxiv.org/abs/2606.18664,NeuralMUSIC: A Hybrid Neural-Subspace Framework for Robot Sound Source Localization,arxiv,cs
2026-07-09,https://arxiv.org/abs/2606.19042,Where Did the Variability Go? From Vibe Coding to Product Lines by Regeneration,arxiv,cs
2026-07-09,https://arxiv.org/abs/2606.23010,A Novel Approach to Temporal QoS Estimation via Extended Kalman Filter-Incorporated Latent Feature Analysis,arxiv,cs
2026-07-09,https://arxiv.org/abs/2606.23604,Polycepta: Object-Centric Appearance Estimation for Multi-Object Tracking,arxiv,cs
2026-07-09,https://arxiv.org/abs/2606.24894,RWGBench: Evaluating Scholarly Positioning in Related Work Generation,arxiv,cs
2026-07-09,https://arxiv.org/abs/2606.26028,Can Trustless Agents Be Trusted? An Empirical Study of the ERC-8004 Decentralized AI Agent Ecosystem,arxiv,cs
2026-07-09,https://arxiv.org/abs/2606.28320,WARP-RM: A Warp-Augmented Relative Progress Reward Model for Data Curation,arxiv,cs
2026-07-09,https://arxiv.org/abs/2606.28421,JuZhou 1.0 Technical Report: The First Edge-Native Text-to-Image Foundation Model Trained Entirely on China-Developed AI Accelerators,arxiv,cs
2026-07-09,https://arxiv.org/abs/2606.28469,When May I Help You? On The Effect of Proactivity on Group Human-Robot Collaboration,arxiv,cs
2026-07-09,https://arxiv.org/abs/2606.29251,When Summaries Distort Decisions: Information Fidelity in LLM-Compressed Financial Analysis,arxiv,cs
2026-07-09,https://arxiv.org/abs/2606.29358,LAMP: Long-Horizon Adaptive Manipulation Planning for Multi-Robot Collaboration in Cluttered Space,arxiv,cs
2026-07-09,https://arxiv.org/abs/2607.03663,Phase-Preserving Trimodal Transformer for Tropical Forest Biomass Estimation Using Optical and PolInSAR Data,arxiv,cs
2026-07-09,https://arxiv.org/abs/2607.04581,MTEB-BR: A Text Embedding Benchmark for Brazilian Portuguese,arxiv,cs
2026-07-09,https://arxiv.org/abs/2607.04758,AgenticPD: A Stage-Aware Agentic Framework for Physical Design QoR Optimization,arxiv,cs
2026-07-09,https://arxiv.org/abs/2607.04987,Data-Driven Soft Labeling Scales DNA Read Classification to Whole-Body Cell-Type Deconvolution,arxiv,cs
2026-07-09,https://arxiv.org/abs/2607.05025,Uncertainty-aware damage identification in short-span bridges via physics-informed variational autoencoder,arxiv,cs
2026-07-09,https://arxiv.org/abs/2607.05382,Search Beyond What Can Be Taught: Evolving the Knowledge Boundary in Agentic Visual Generation,arxiv,cs
2026-07-09,https://arxiv.org/abs/2607.05394,Weak-to-Strong Generalization via Direct On-Policy Distillation,arxiv,cs
2026-07-09,https://arxiv.org/abs/2607.06121,Can Reinforcement Learning Efficiently Discover Price Manipulation?,arxiv,cs
2026-07-09,https://arxiv.org/abs/2607.06569,Towards a Pseudo-Labeling Workflow for Celltype-Classification from Explanted Brain Slice Recordings,arxiv,cs
2026-07-09,https://arxiv.org/abs/2607.06579,Recovering Candidate Circadian Regulators of Arrhythmic Pituitary Hormone Genes Using Reliability-Weighted Magnetic Laplacian with rwMagLap,arxiv,cs
2026-07-09,https://arxiv.org/abs/2607.06583,Trajectory Inference of Human Aging from Cross-Sectional DNA Methylation Data,arxiv,cs
2026-07-09,https://arxiv.org/abs/2607.06585,Pixel-Precise Explainable Stress Indexing: A Semantic Segmentation Framework for Disease Severity Quantification in Field Crops,arxiv,cs
2026-07-09,https://arxiv.org/abs/2607.06590,AI for Cultural Heritage Textiles: Fine-Tuned Latent Diffusion for Novel Ulos Motif Synthesis,arxiv,cs
2026-07-09,https://arxiv.org/abs/2607.06592,LipSSD: Lipschitz-Constrained Single-Shot Detection for Adversarially Robust Object Detection,arxiv,cs
2026-07-09,https://arxiv.org/abs/2607.06595,When Agents Remember Too Much: Memory Poisoning Attacks on Large Language Model Agents,arxiv,cs
2026-07-09,https://arxiv.org/abs/2607.06596,Calibration-Family Overfit: Why Trusted Sabotage Monitors Don't Transfer Across Lineages,arxiv,cs
2026-07-09,https://arxiv.org/abs/2607.06598,"Non-contact, Real-time, Heart-rate Measurement using Image Processing with Commodity Cameras and AI Agents",arxiv,cs
