date,url,title,source,category
2026-06-19,https://arxiv.org/abs/2606.20272,Efficiently Linking Real Scenes with Synthetic Data Generation for AI-based Cognitive Robotics and Computer Vision Applications,arxiv,cs
2026-06-19,https://arxiv.org/abs/2606.20274,"Lagrange: An Open-Vocabulary, Energy-Based Sparse Framework for Generalized End-to-End Driving",arxiv,cs
2026-06-19,https://arxiv.org/abs/2606.20280,ELVA: Exploring Ranking-Driven Universal Multimodal Retrieval,arxiv,cs
2026-06-19,https://arxiv.org/abs/2606.20283,Boundary Embedding Shaping with Adaptive Contrastive Learning for Graph Structural Disentanglement,arxiv,cs
2026-06-19,https://arxiv.org/abs/2606.20285,Co-VLA: Coordination-Aware Structured Action Modeling for Dual-Arm Vision-Language-Action Systems,arxiv,cs
2026-06-19,https://arxiv.org/abs/2606.20291,"Integrating national forest inventory, airborne lidar, and satellite imagery for wall-to-wall mapping of forest structure with computer vision",arxiv,cs
2026-06-19,https://arxiv.org/abs/2606.20292,Shifting-based Optimizable Linear Relaxations for General Activation Functions,arxiv,cs
2026-06-19,https://arxiv.org/abs/2606.20322,Towards 3D karst underwater scene reconstruction from rotating sonar data,arxiv,cs
2026-06-19,https://arxiv.org/abs/2606.20323,Leveraging systems' non-linearity to tackle the scarcity of data in the design of Intelligent Fault Diagnosis Systems,arxiv,cs
2026-06-19,https://arxiv.org/abs/2606.20324,A Model-Driven Approach for Developing Families of Reinforcement Learning Environments,arxiv,cs
2026-06-19,https://arxiv.org/abs/2606.20325,Recurrent neural networks approximate continuous functions,arxiv,cs
2026-06-19,https://arxiv.org/abs/2606.20326,Quantum-classical physics-informed Kolmogorov-Arnold networks for PDEs,arxiv,cs
2026-06-19,https://arxiv.org/abs/2606.20329,Constrained hybrid modelling to predict microbial dynamics and organic matter turnover in soil systems,arxiv,cs
2026-06-19,https://arxiv.org/abs/2606.20333,SoftSkill: Behavioral Compression for Contextual Adaptation,arxiv,cs
2026-06-19,https://arxiv.org/abs/2606.20336,Autonomous Driving with Priority-Ordered STL Specifications Under Multimodal Uncertainty,arxiv,cs
2026-06-19,https://arxiv.org/abs/2606.20344,Quantum ring all-reduce: communication and privacy advantages for distributed learning,arxiv,cs
2026-06-19,https://arxiv.org/abs/2606.20347,Critical Percolation as a Synthetic Data Model for Interpretability,arxiv,cs
2026-06-19,https://arxiv.org/abs/2606.20357,On the Variance of Temporal Difference Learning and its Reduction Using Control Variates,arxiv,cs
2026-06-19,https://arxiv.org/abs/2606.20359,"Train, Retrieve, or Both? A Four-Arm Head-to-Head for Correct Statutory Citation on the Ontario Residential Tenancies Act",arxiv,cs
2026-06-19,https://arxiv.org/abs/2606.20363,Automating SKILL.md Generation for Computer-Using Agents via Interaction Trajectory Mining,arxiv,cs
2026-06-19,https://arxiv.org/abs/2606.20364,Judging to Improve: A De-biased VLM-as-3D-Judge Protocol for Single-Image 3D Generation,arxiv,cs
2026-06-19,https://arxiv.org/abs/2606.20365,"An Infrastructure-less, Control-Independent Solution to Relative Localisation of a Team of Mobile Robots using Ranging Measurements",arxiv,cs
2026-06-19,https://arxiv.org/abs/2606.20373,AutoPass: Evidence-Guided LLM Agents for Compiler Performance Tuning,arxiv,cs
2026-06-19,https://arxiv.org/abs/2606.20376,CRAX: Fast Safe Reinforcement Learning Benchmarking,arxiv,cs
2026-06-19,https://arxiv.org/abs/2606.20381,"Rethinking Shrinkage Bias in LLM FP4 Pretraining: Geometric Origin, Systemic Impact, and UFP4 Recipe",arxiv,cs
2026-06-19,https://arxiv.org/abs/2606.20382,Towards Modality-imbalanced Federated Graph Learning: A Data Synthesis-based Approach,arxiv,cs
2026-06-19,https://arxiv.org/abs/2606.20388,DataMagic: Transforming Tabular Data into Data Insight Video,arxiv,cs
2026-06-19,https://arxiv.org/abs/2606.20389,CoLI: A Reproducible Platform for Continuum Robot Learning via Monolithic 3D Printing and Isomorphic Teleoperation,arxiv,cs
2026-06-19,https://arxiv.org/abs/2606.20394,"Agentic AutoResearch forSpace Autonomy: An Auditable, LLM-Driven Research Agent for Aerospace Control Problems",arxiv,cs
2026-06-19,https://arxiv.org/abs/2606.20400,The Significance of Style Diversity in Annotation-Free Synthetic Data Generation,arxiv,cs
2026-06-19,https://arxiv.org/abs/2606.20408,"LLM agent safety, multi-turn red-teaming, jailbreak benchmarks, adversarial robustness, safety-critical systems",arxiv,cs
2026-06-19,https://arxiv.org/abs/2606.20411,Direct Advantage Estimation for Scalable and Sample-efficient Deep Reinforcement Learning,arxiv,cs
2026-06-19,https://arxiv.org/abs/2606.20415,Pseudo-Feature Padding: A Lightweight Defense Against False Data Injection in Power Grids,arxiv,cs
2026-06-19,https://arxiv.org/abs/2606.20416,On the Redundancy of Timestep Embeddings in Diffusion Models,arxiv,cs
2026-06-19,https://arxiv.org/abs/2606.20417,Neural network surrogates with uncertainty quantification for inverse problems in partial differential equations,arxiv,cs
2026-06-19,https://arxiv.org/abs/2606.20424,LIT-GS: LiDAR-Inertial-Thermal Gaussian Splatting for Illumination-Robust Mapping,arxiv,cs
2026-06-19,https://arxiv.org/abs/2606.20426,TaCauchy: An Extensible FEM Framework for Vision-Based Tactile Simulation,arxiv,cs
2026-06-19,https://arxiv.org/abs/2606.20428,ARC: Adaptive Robust Joint State and Covariance Estimation,arxiv,cs
2026-06-19,https://arxiv.org/abs/2606.20431,"Sparsity, Superposition, and Forgetting: A Mechanistic Study of Representation Retention in Continual Learning",arxiv,cs
2026-06-19,https://arxiv.org/abs/2606.20436,Multi-View Decompilation for LLM-Based Malware Classification,arxiv,cs
2026-06-19,https://arxiv.org/abs/2606.20437,HEPTv2: End-to-End Efficient Point Transformer for Charged Particle Reconstruction,arxiv,cs
2026-06-19,https://arxiv.org/abs/2606.20438,Interpretable Sperm Morphology Classification via Attention-Guided Deep Learning,arxiv,cs
2026-06-19,https://arxiv.org/abs/2606.20442,Evolutionary Two-Stage Hyperparameter Optimization Strategies for Physics-Informed Neural Networks,arxiv,cs
2026-06-19,https://arxiv.org/abs/2606.20443,Topological Data Analysis for High-Dimensional Dynamic Process Monitoring,arxiv,cs
2026-06-19,https://arxiv.org/abs/2606.20457,Repurposing a Speech Classifier for Guided Diffusion-Based Speech Generation,arxiv,cs
2026-06-19,https://arxiv.org/abs/2606.20458,"Slow Brain, Fast Planner: Latency-Resilient VLM-Augmented Urban Navigation",arxiv,cs
2026-06-19,https://arxiv.org/abs/2606.20459,Context-Aware Hierarchical Bayesian Modeling of IVF Laboratory Environmental Conditions,arxiv,cs
2026-06-19,https://arxiv.org/abs/2606.20461,Data Bias Mitigation under Coverage Constraints & The Price of Fairness,arxiv,cs
2026-06-19,https://arxiv.org/abs/2606.20467,"Agentic Symbolic Search: Characterizing PDEs Beyond Hand-crafted Expressions, Meshes, and Neural Networks",arxiv,cs
2026-06-19,https://arxiv.org/abs/2606.20469,Fisher-Geometric Sharpness and the Implicit Bias of SGD toward Flat Minima,arxiv,cs
2026-06-19,https://arxiv.org/abs/2606.20470,Analyzing Defensive Misdirection Against Model-Guided Automated Attacks on Agentic AI Systems,arxiv,cs
2026-06-19,https://arxiv.org/abs/2606.20474,UltraQuant: 4-bit KV Caching for Context-Heavy Agents,arxiv,cs
2026-06-19,https://arxiv.org/abs/2606.20475,Marginal Advantage Accumulation for Memory-Driven Agent Self-Evolution,arxiv,cs
2026-06-19,https://arxiv.org/abs/2606.20477,Scalable Training of Spatially Grounded 2D Vision-Language Models for Radiology,arxiv,cs
2026-06-19,https://arxiv.org/abs/2606.20479,GroundControl: Anticipating Navigation Failures in Vision-Language Agents via Trajectory-Consistent Uncertainty Estimates,arxiv,cs
2026-06-19,https://arxiv.org/abs/2606.20482,Your Mouse and Eyes Secretly Leak Your Preference: LLM Alignment using Implicit Feedback from Users,arxiv,cs
2026-06-19,https://arxiv.org/abs/2606.20485,Optimal Order of Multi-Agent and General Many-Body Systems,arxiv,cs
2026-06-19,https://arxiv.org/abs/2606.20491,Fast Human Attention Prediction for Fixation-guided Active Perception in Autonomous Navigation,arxiv,cs
2026-06-19,https://arxiv.org/abs/2606.20493,Contagion Networks: Evaluator Bias Propagation in Multi-Agent LLM Systems,arxiv,cs
2026-06-19,https://arxiv.org/abs/2606.20495,Increasing Resilience of Continuum Robots via Motion Planning Algorithms,arxiv,cs
2026-06-19,https://arxiv.org/abs/2606.20502,Calibration Without Comprehension: Diagnosing the Limits of Fine-Tuning LLMs for Vulnerability Detection in Systems Software,arxiv,cs
2026-06-19,https://arxiv.org/abs/2606.20504,Entropy Estimation in Multi-Qutrit Systems via Variational and Classical Neural Networks,arxiv,cs
2026-06-19,https://arxiv.org/abs/2606.20506,FreeStyle: Free Control of Style-Content Dual-Reference Generation from Community LoRA Mining,arxiv,cs
2026-06-19,https://arxiv.org/abs/2606.20508,What Do Safety-Aligned LLMs Learn From Mixed Compliance Demonstrations?,arxiv,cs
2026-06-19,https://arxiv.org/abs/2606.20510,Efficient and Sound Probabilistic Verification for AI Agents,arxiv,cs
2026-06-19,https://arxiv.org/abs/2606.20512,Probe-and-Refine Tuning of Repository Guidance for Coding Agents,arxiv,cs
2026-06-19,https://arxiv.org/abs/2606.20517,Multi-LCB: Extending LiveCodeBench to Multiple Programming Languages,arxiv,cs
2026-06-19,https://arxiv.org/abs/2606.20518,FlowEdit: Associative Memory for Lifelong Pronunciation Adaptation in Flow-Matching TTS,arxiv,cs
2026-06-19,https://arxiv.org/abs/2606.20520,Sovereign Execution Brokers: Enforcing Certificate-Bound Authority in Agentic Control Planes,arxiv,cs
2026-06-19,https://arxiv.org/abs/2606.20523,SARLO-80: Worldwide Slant SAR Language Optic Dataset 80cm,arxiv,cs
2026-06-19,https://arxiv.org/abs/2606.20526,DeepSWIP: Quotient-WMC Counterfactuals for Neural Probabilistic Logic Programs,arxiv,cs
2026-06-19,https://arxiv.org/abs/2606.20529,LedgerAgent: Structured State for Policy-Adherent Tool-Calling Agents,arxiv,cs
2026-06-19,https://arxiv.org/abs/2606.20532,How Do Instructions Shape Speech? Cross-Attention Attribution for Style-Captioned Text-to-Speech,arxiv,cs
2026-06-19,https://arxiv.org/abs/2606.20537,"Execution-State Capsules: Graph-Bound Execution-State Checkpoint and Restore for Low-Latency, Small-Batch, On-Device Physical-AI Serving",arxiv,cs
2026-06-19,https://arxiv.org/abs/2606.20538,Multi-Task Bayesian In-Context Learning,arxiv,cs
2026-06-19,https://arxiv.org/abs/2606.20544,Toward Calibrated Mixture-of-Experts Under Distribution Shift,arxiv,cs
2026-06-19,https://arxiv.org/abs/2606.20546,Predictability as a Fine-Grained Measure for Privacy,arxiv,cs
2026-06-19,https://arxiv.org/abs/2606.20547,The Token Is a Group Element: On Lie-Algebra Attention over Matrix Lie Groups,arxiv,cs
2026-06-19,https://arxiv.org/abs/2606.20549,Generating Robot Hands from Human Demonstrations,arxiv,cs
2026-06-19,https://arxiv.org/abs/2606.20554,Structuring and Tokenizing Distributed User Interest Context for Generative Recommendation,arxiv,cs
2026-06-19,https://arxiv.org/abs/2606.20559,UNIEGO: Proxies as Mediators for Unified Egocentric Video Representation Learning,arxiv,cs
2026-06-19,https://arxiv.org/abs/2606.20560,How Transparent is DiffusionGemma?,arxiv,cs
2026-06-19,https://arxiv.org/abs/2606.20562,MemoryWAM: Efficient World Action Modeling with Persistent Memory,arxiv,cs
2026-06-19,https://arxiv.org/abs/1905.06571,"Morrey's conjecture: rank-one convexity implies quasi-convexity for two-dimensional, two-component maps",arxiv,math
2026-06-19,https://arxiv.org/abs/2303.15093,Coercive quadratic converse ISS Lyapunov theorems for linear analytic systems,arxiv,math
2026-06-19,https://arxiv.org/abs/2407.09213,Projection onto hyperbolicity cones and beyond: a dual Frank-Wolfe approach,arxiv,math
2026-06-19,https://arxiv.org/abs/2408.14452,Taxicab distance based best-worst method for multi-criteria decision-making: An analytical approach,arxiv,math
2026-06-19,https://arxiv.org/abs/2506.01694,Cross-Dock Door Design under Uncertainty: A two-stage DRO-based lower- and upper-bounding scheme,arxiv,math
2026-06-19,https://arxiv.org/abs/2506.19155,Relative Explanations for Contextual Problems with Endogenous Uncertainty: An Application to Competitive Facility Location,arxiv,math
2026-06-19,https://arxiv.org/abs/2507.10188,Well-posedness of an optical flow based optimal control formulation for image registration,arxiv,math
2026-06-19,https://arxiv.org/abs/2511.14280,A graph-informed regret metric for optimal distributed control,arxiv,math
2026-06-19,https://arxiv.org/abs/2512.06939,Numerical Algebraic Geometry for Energy Computations on Tensor Train Varieties,arxiv,math
2026-06-19,https://arxiv.org/abs/2512.19446,An alternative approach to well-posedness of McKean-Vlasov equations arising in Consensus-Based Optimization,arxiv,math
2026-06-19,https://arxiv.org/abs/2602.14621,Extragradient methods for mean field games of controls and mean field type FBSDEs,arxiv,math
2026-06-19,https://arxiv.org/abs/2603.10336,A Globally Convergent Flow for Time-Dependent Mean Field Games and a Solver-Agnostic Framework for Inverse Problems,arxiv,math
2026-06-19,https://arxiv.org/abs/2603.16865,Prescribed-Time Distributed Generalized Nash Equilibrium Seeking,arxiv,math
2026-06-19,https://arxiv.org/abs/2603.20455,Time-Reversed BSDEs for Accurate Gradient Estimation in Diffusion Models,arxiv,math
2026-06-19,https://arxiv.org/abs/2604.27260,Exact Flatness Constant for One-Point Convex Bodies and the Discrete Isominwidth Problem: The Planar Case,arxiv,math
2026-06-19,https://arxiv.org/abs/2605.10526,Randomized Max-Vertex-Coverage Interdiction under Matroid Constraints,arxiv,math
2026-06-19,https://arxiv.org/abs/2606.01505,Inexactly Smooth Performance Estimation and New Optimized Gradient Methods,arxiv,math
2026-06-19,https://arxiv.org/abs/2606.19516,"A land of monotone plenty, bis repetita: from classical to weak optimal transport",arxiv,math
2026-06-19,https://arxiv.org/abs/2606.19553,On the Limits of Biased Derivative Information for Nonconvex Stochastic Optimization,arxiv,math
2026-06-19,https://arxiv.org/abs/2606.19639,Mean-Field Control with a Common Hidden State under Decentralized Observations,arxiv,math
2026-06-19,https://arxiv.org/abs/2606.19663,Counterexample to a conjecture on the pairwise independent correlation gap using AI,arxiv,math
2026-06-19,https://arxiv.org/abs/2606.19669,Learning Neural Maximal Lyapunov Functions on $\mathsf{SO}(n)$,arxiv,math
2026-06-19,https://arxiv.org/abs/2606.19695,A Unified Framework for Joint Sensor Placement and Scheduling for Intrusion Detection,arxiv,math
2026-06-19,https://arxiv.org/abs/2606.19705,Stochastic Representations of Stationary HJBI-Type Variational Inequalities with Bilateral Constraints,arxiv,math
2026-06-19,https://arxiv.org/abs/2606.19751,DeQL: A Decision Query Language for Prescriptive Analytics over Relational Data,arxiv,math
2026-06-19,https://arxiv.org/abs/2606.19772,Signature Methods for Optimal Market Making,arxiv,math
2026-06-19,https://arxiv.org/abs/2606.20013,A Regularized Nikaido-Isoda Function Approach to Multi-Leader-Follower Games,arxiv,math
2026-06-19,https://arxiv.org/abs/2606.20059,Optimization with inequality constraints by the embedded gradient vector field method,arxiv,math
2026-06-19,https://arxiv.org/abs/2606.20239,Optimizing Agricultural Drone Operations: From Launch and Recovery Siting to Tiered Routing Strategies,arxiv,math
2026-06-19,https://arxiv.org/abs/2606.20304,Diagonal Hessian Approximation Based on Conjugacy Condition for Noisy Derivative-Free Optimization Problems in High Dimensions,arxiv,math
2026-06-19,https://arxiv.org/abs/2606.20383,A Single-Loop Minorized Dual Decomposition Method for Nonsmooth Multi-Stage Stochastic Programming,arxiv,math
2026-06-19,https://arxiv.org/abs/2606.20446,High-Probability Last-Iterate Guarantees for Two-Point Gaussian Zeroth-Order Stochastic Gradient Descent,arxiv,math
2026-06-19,https://arxiv.org/abs/2606.20498,CLUSTER: Derivative-free optimization of smooth functions with parameter-change costs,arxiv,math
2026-06-19,https://arxiv.org/abs/2606.20534,On Second-Order Methods for Bilevel Optimization,arxiv,math
2026-06-19,https://huggingface.co/papers/2606.19338,Beyond the Current Observation: Evaluating Multimodal Large Language Models in Controllable Non-Markov Games (38▲),huggingface,
2026-06-19,https://huggingface.co/papers/2606.18558,MolmoMotion: Forecasting Point Trajectories in 3D with Language Instruction (32▲),huggingface,
2026-06-19,https://huggingface.co/papers/2606.16533,Kairos: A Native World Model Stack for Physical AI (27▲),huggingface,
2026-06-19,https://huggingface.co/papers/2606.18363,Guava: An Effective and Universal Harness for Embodied Manipulation (23▲),huggingface,
2026-06-19,https://huggingface.co/papers/2606.19162,The Reward Was in Your Data All Along: Correcting Flow Matching with Discriminator-Guided RL (16▲),huggingface,
2026-06-19,https://huggingface.co/papers/2606.18322,SAE Interventions are Unreliable: Post-Intervention Recovery of Suppressed Behavior (15▲),huggingface,
2026-06-19,https://huggingface.co/papers/2606.17682,From Trainee to Trainer: LLM-Designed Training Environment for RL with Multi-Agent Reasoning (13▲),huggingface,
2026-06-19,https://huggingface.co/papers/2606.17539,Reinforcing Dual-Path Reasoning in Spatial Vision Language Models (13▲),huggingface,
2026-06-19,https://huggingface.co/papers/2606.19341,Native Active Perception as Reasoning for Omni-Modal Understanding (11▲),huggingface,
2026-06-19,https://huggingface.co/papers/2606.17800,MaineCoon: Pursuing A Real-Time Audio-Visual Social World Model (8▲),huggingface,
2026-06-19,https://huggingface.co/papers/2606.18967,EfficientRollout: System-Aware Self-Speculative Decoding for RL Rollouts (8▲),huggingface,
2026-06-19,https://huggingface.co/papers/2606.05985,Beyond Alignment: Value Diversity as a Collective Property in Multicultural Agent Systems (8▲),huggingface,
2026-06-20,https://huggingface.co/papers/2606.19195,Moebius: 0.2B Lightweight Image Inpainting Framework with 10B-Level Performance (96▲),huggingface,
2026-06-20,https://huggingface.co/papers/2606.15133,DragMesh-2: Physically Plausible Dexterous Hand-Object Interaction with Articulated Objects (61▲),huggingface,
2026-06-20,https://huggingface.co/papers/2606.19419,Playful Agentic Robot Learning (35▲),huggingface,
2026-06-20,https://huggingface.co/papers/2606.20515,S-Agent: Spatial Tool-Use Elicits Reasoning for Spatial Intelligence (27▲),huggingface,
2026-06-20,https://huggingface.co/papers/2606.20517,Multi-LCB: Extending LiveCodeBench to Multiple Programming Languages (26▲),huggingface,
2026-06-20,https://huggingface.co/papers/2606.19704,Beyond Static Leaderboards: Predictive Validity for the Evaluation of LLM Agents (21▲),huggingface,
2026-06-20,https://huggingface.co/papers/2606.20506,FreeStyle: Free Control of Style-Content Dual-Reference Generation from Community LoRA Mining (18▲),huggingface,
2026-06-20,https://huggingface.co/papers/2606.20563,JanusMesh: Fast and Zero-Shot 3D Visual Illusion Generation via Cross-Space Denoising (16▲),huggingface,
2026-06-20,https://huggingface.co/papers/2606.20404,FlowBender: Feedback-Aware Training for Self-Correcting Conditional Flows (15▲),huggingface,
2026-06-20,https://huggingface.co/papers/2604.13416,DF3DV-1K: A Large-Scale Dataset and Benchmark for Distractor-Free Novel View Synthesis (9▲),huggingface,
2026-06-20,https://huggingface.co/papers/2606.19531,"ImageWAM: Do World Action Models Really Need Video Generation, or Just Image Editing? (9▲)",huggingface,
2026-06-20,https://huggingface.co/papers/2606.19980,ENPIRE: Agentic Robot Policy Self-Improvement in the Real World (7▲),huggingface,
2026-06-23,https://arxiv.org/abs/2007.01497,A new non-parametric test for multivariate paired data from pair matching or paired designs,arxiv,stat
2026-06-23,https://arxiv.org/abs/2010.14694,Deep Learning for Individual Heterogeneity,arxiv,stat
2026-06-23,https://arxiv.org/abs/2209.05474,Consistent Selection of the Number of Groups in Panel Models via Cross-Validation,arxiv,stat
2026-06-23,https://arxiv.org/abs/2210.00310,Parametrized Power-Iteration Clustering for Directed Graphs,arxiv,stat
2026-06-23,https://arxiv.org/abs/2210.01679,Detection and Evaluation of Clusters within Sequential Data,arxiv,stat
2026-06-23,https://arxiv.org/abs/2210.07114,From Risk Sets to Martingales: A Counting-Process Framework for Event-History Learning,arxiv,stat
2026-06-23,https://arxiv.org/abs/2211.03031,A framework for leveraging machine learning tools to estimate personalized survival curves,arxiv,stat
2026-06-23,https://arxiv.org/abs/2212.02107,Matrix-valued Network Autoregression Model with Latent Group Structure,arxiv,stat
2026-06-23,https://arxiv.org/abs/2305.10878,Dynamic cross-scale wavelet coherence,arxiv,stat
2026-06-23,https://arxiv.org/abs/2403.17489,Adaptive Bayesian Structure Learning of DAGs With Non-conjugate Prior,arxiv,stat
2026-06-23,https://arxiv.org/abs/2405.09080,Causal Inference with a Hidden Treatment,arxiv,stat
2026-06-23,https://arxiv.org/abs/2405.14509,Closed-form estimators for an exponential family derived from likelihood equations,arxiv,stat
2026-06-23,https://arxiv.org/abs/2405.18722,Adaptive and Efficient Learning with Blockwise Missing and Semi-Supervised Data,arxiv,stat
2026-06-23,https://arxiv.org/abs/2406.13635,Permutation Recovery on Manifold Data via Spectral Seriation,arxiv,stat
2026-06-23,https://arxiv.org/abs/2407.06765,A Generalization Bound for Nearly-Linear Networks,arxiv,stat
2026-06-23,https://arxiv.org/abs/2410.02548,Local Flow Matching Generative Models,arxiv,stat
2026-06-23,https://arxiv.org/abs/2410.24056,A Martingale-Free Introduction to Conditional Gaussian Nonlinear Systems,arxiv,stat
2026-06-23,https://arxiv.org/abs/2411.05870,An Adaptive Online Smoother with Closed-Form Solutions and Information-Theoretic Lag Selection for Conditional Gaussian Nonlinear Systems,arxiv,stat
2026-06-23,https://arxiv.org/abs/2412.05109,Generating Rectifiable Measures through Neural Networks,arxiv,stat
2026-06-23,https://arxiv.org/abs/2412.08567,Identifiability of the instrumental variable model with the treatment and outcome missing not at random,arxiv,stat
2026-06-23,https://arxiv.org/abs/2501.09731,Predictions as Surrogates: Revisiting Surrogate Outcomes in the Age of AI,arxiv,stat
2026-06-23,https://arxiv.org/abs/2501.13355,Evidence aggregation with ignorance in mind: learning what we do (not) know for archetypes discovery,arxiv,stat
2026-06-23,https://arxiv.org/abs/2503.10251,Numerical stability analysis of large language models,arxiv,stat
2026-06-23,https://arxiv.org/abs/2503.17308,On Quantum Perceptron Learning via Quantum Search,arxiv,stat
2026-06-23,https://arxiv.org/abs/2503.19748,No-prior Bayes reIMagined: probabilistic approximations of inferential models,arxiv,stat
2026-06-23,https://arxiv.org/abs/2503.21321,Explainable Boosting Machine for Predicting Claim Severity and Frequency in Car Insurance,arxiv,stat
2026-06-23,https://arxiv.org/abs/2505.01318,Modeling Large Nonstationary Spatial Data with the Full-Scale Basis Graphical Lasso,arxiv,stat
2026-06-23,https://arxiv.org/abs/2505.12462,Model-Free Robust Average-Reward Reinforcement Learning with Sample Complexity Analysis,arxiv,stat
2026-06-23,https://arxiv.org/abs/2505.18281,Measuring the Impact of Missingness in Traffic Stop Data,arxiv,stat
2026-06-23,https://arxiv.org/abs/2505.19061,Hierarchical Adversarial Bandits for Online Configuration Optimization,arxiv,stat
2026-06-23,https://arxiv.org/abs/2506.01258,Neural Networks for Parameter Estimation of the Discretely Observed Hawkes Process,arxiv,stat
2026-06-23,https://arxiv.org/abs/2506.23921,The Trilemma of Truth in Large Language Models,arxiv,stat
2026-06-23,https://arxiv.org/abs/2507.09634,Correction for Weak IV Bias and Winner's Curse in Mendelian Randomization Egger Regression: Rerandomized Egger estimator,arxiv,stat
2026-06-23,https://arxiv.org/abs/2507.10443,Associative Memory for Non-Stationary Environments: A Self-Sizing Generalization of Hopfield Networks,arxiv,stat
2026-06-23,https://arxiv.org/abs/2507.15232,Robust and Differentially Private Principal Component Analysis,arxiv,stat
2026-06-23,https://arxiv.org/abs/2507.15741,Conformal and kNN Predictive Uncertainty Quantification Algorithms in Metric Spaces,arxiv,stat
2026-06-23,https://arxiv.org/abs/2508.05212,High-Dimensional Differentially Private Quantile Regression: Distributed Estimation and Statistical Inference,arxiv,stat
2026-06-23,https://arxiv.org/abs/2508.05663,Random Walk Learning and the Pac-Man Attack,arxiv,stat
2026-06-23,https://arxiv.org/abs/2508.11622,Deconfounding via Profiled Transfer Learning,arxiv,stat
2026-06-23,https://arxiv.org/abs/2508.16312,Tree-based methods for length-biased survival data,arxiv,stat
2026-06-23,https://arxiv.org/abs/2508.17142,Frequency Response Identification of Low-Order Systems: Finite-Sample Analysis,arxiv,stat
2026-06-23,https://arxiv.org/abs/2509.06218,The Efficiency Frontier: Classical Shadows versus Direct Quantum Measurement,arxiv,stat
2026-06-23,https://arxiv.org/abs/2509.23946,Explore-Execute Chain: Towards an Efficient Structured Reasoning Paradigm,arxiv,stat
2026-06-23,https://arxiv.org/abs/2510.01022,VDW-GNNs: Vector diffusion wavelets for geometric graph neural networks,arxiv,stat
2026-06-23,https://arxiv.org/abs/2510.01734,Stabilizing Thompson Sampling with Null Hypothesis Bayesian Response-Adaptive Randomization,arxiv,stat
2026-06-23,https://arxiv.org/abs/2510.07314,GyroSwin: 5D Surrogates for Gyrokinetic Plasma Turbulence Simulations,arxiv,stat
