date,url,title,source,category
2026-06-18,https://arxiv.org/abs/1712.09566,Mixture model fitting using conditional models and modal Gibbs sampling,arxiv,stat
2026-06-18,https://arxiv.org/abs/2406.14399,Benchmarking Physics-Informed Time-Series Models for Operational Global Station Weather Forecasting,arxiv,stat
2026-06-18,https://arxiv.org/abs/2407.20085,Local Level Dynamic Random Partition Models for Changepoint Detection,arxiv,stat
2026-06-18,https://arxiv.org/abs/2501.11996,Experimental Designs for Multi-Item Multi-Period Inventory Control,arxiv,stat
2026-06-18,https://arxiv.org/abs/2502.07641,Distributional Instrumental Variable Method,arxiv,stat
2026-06-18,https://arxiv.org/abs/2503.18351,Parametric inference for the discretely observed multivariate Hawkes process using particle Markov Chain Monte Carlo,arxiv,stat
2026-06-18,https://arxiv.org/abs/2505.15215,Clustering and Pruning in Causal Data Fusion,arxiv,stat
2026-06-18,https://arxiv.org/abs/2507.07156,Unreduced Persistence Diagrams for Topological Machine Learning,arxiv,stat
2026-06-18,https://arxiv.org/abs/2507.18824,Deep Neural Network Driven Simulation Based Inference Method for Pole Position Estimation under Model Misspecification,arxiv,stat
2026-06-18,https://arxiv.org/abs/2508.06402,Coverage correlation: detecting singular dependencies between random variables,arxiv,stat
2026-06-18,https://arxiv.org/abs/2509.10064,From customer survey feedback to software improvements: Leveraging the full potential of data,arxiv,stat
2026-06-18,https://arxiv.org/abs/2509.14183,Index Date Imputation for Survival Analysis in Externally Controlled Trials with Delayed Treatment Initiation,arxiv,stat
2026-06-18,https://arxiv.org/abs/2509.14969,Stochastic Adaptive Gradient Descent Without Descent,arxiv,stat
2026-06-18,https://arxiv.org/abs/2511.00366,A Streaming Sparse Cholesky Method for Derivative-Informed Gaussian Process Surrogates Within Digital Twin Applications,arxiv,stat
2026-06-18,https://arxiv.org/abs/2511.14992,An Estimand-Focused Approach for AUC Generalization and Cross-Study Benchmarking,arxiv,stat
2026-06-18,https://arxiv.org/abs/2602.02056,Ultrafast On-chip Online Learning via Spline Locality in Kolmogorov-Arnold Networks,arxiv,stat
2026-06-18,https://arxiv.org/abs/2602.06518,Sequential Auditing for f-Differential Privacy,arxiv,stat
2026-06-18,https://arxiv.org/abs/2602.14789,On the Stability of Nonlinear Dynamics in GD and SGD: Beyond Quadratic Potentials,arxiv,stat
2026-06-18,https://arxiv.org/abs/2602.17187,Anti-causal domain generalization: Leveraging unlabeled data,arxiv,stat
2026-06-18,https://arxiv.org/abs/2602.21160,"Not Just How Much, But Where: Decomposing Epistemic Uncertainty into Per-Class Contributions",arxiv,stat
2026-06-18,https://arxiv.org/abs/2602.23006,Regular Fourier Features for Nonstationary Gaussian Processes,arxiv,stat
2026-06-18,https://arxiv.org/abs/2603.04895,How Does the ReLU Activation Affect the Implicit Bias of Gradient Descent on High-dimensional Neural Network Regression?,arxiv,stat
2026-06-18,https://arxiv.org/abs/2603.09344,Robust Regularized Policy Iteration under Transition Uncertainty,arxiv,stat
2026-06-18,https://arxiv.org/abs/2604.04141,On Data Thinning for Model Validation in Small Area Estimation,arxiv,stat
2026-06-18,https://arxiv.org/abs/2604.04342,Generative models for decision-making under distributional shift,arxiv,stat
2026-06-18,https://arxiv.org/abs/2605.17232,Dimension-Free Convergence of Discrete Diffusion Models: Adjoint Equations Induce the Right Space,arxiv,stat
2026-06-18,https://arxiv.org/abs/2605.20726,Everywhere Valid Bounds on False Discovery Proportions in Conformal Inference,arxiv,stat
2026-06-18,https://arxiv.org/abs/2605.22640,Positive-definiteness in separable priors: effects on prior interpretability and inference,arxiv,stat
2026-06-18,https://arxiv.org/abs/2605.27478,"Triangular-Reference Schr\""odinger Bridges for Time Series Generation",arxiv,stat
2026-06-18,https://arxiv.org/abs/2606.04404,Knockoffs-based False Discovery Rate Control and Simplification for Deep Neural Networks,arxiv,stat
2026-06-18,https://arxiv.org/abs/2606.11136,Conformal Prediction for Dyadic Regression Under Complex Missingness,arxiv,stat
2026-06-18,https://arxiv.org/abs/2606.18281,A Guide to Estimating Conditional Average Treatment Effects in Competing Risks Settings,arxiv,stat
2026-06-18,https://arxiv.org/abs/2606.18306,Fisher Width: A Geometric Measure of Complexity on Statistical Manifolds,arxiv,stat
2026-06-18,https://arxiv.org/abs/2606.18365,Logarithmic energy distances and Gini covariance for Hilbert-valued random elements,arxiv,stat
2026-06-18,https://arxiv.org/abs/2606.18366,A closed-form sample size correction for always-valid inference with optional stopping,arxiv,stat
2026-06-18,https://arxiv.org/abs/2606.18409,Learning Moment Maps for Continuous-Time Markov Chains under Monte Carlo Noise,arxiv,stat
2026-06-18,https://arxiv.org/abs/2606.18412,Bayesian Nonparametric Detection of Anomalies in Multivariate Functional Data,arxiv,stat
2026-06-18,https://arxiv.org/abs/2606.18420,Measurement noise limits the advantage of nonlinear models over linear models in biomedical prediction,arxiv,stat
2026-06-18,https://arxiv.org/abs/2606.18436,Pointwise is Pointless? A Multimodal Ablation Study for Precipitation Nowcasting with Graph Neural Networks,arxiv,stat
2026-06-18,https://arxiv.org/abs/2606.18445,A spectral based coefficient of determination for the fit of an MA(q) model,arxiv,stat
2026-06-18,https://arxiv.org/abs/2606.18446,Covariance shrinkage for cosmological inference with Sellentin-Heavens-type likelihoods,arxiv,stat
2026-06-18,https://arxiv.org/abs/2606.18459,Apportioning Causal Responsibility of Two Risk Factors for an Adverse Outcome via Counterfactual Attribution,arxiv,stat
2026-06-18,https://arxiv.org/abs/2606.18463,Mixed-Precision Communication-Avoiding SGD for Generalized Linear Models on GPUs,arxiv,stat
2026-06-18,https://arxiv.org/abs/2606.18467,ToolChain-CRC: Conformal Risk Control for Agentic AI Under Retrieval and Tool-Use Drift,arxiv,stat
2026-06-18,https://arxiv.org/abs/2606.18491,The Coherence Principle: A Falsifiable Prior for Model Selection from the Grammar of Theories,arxiv,stat
2026-06-18,https://arxiv.org/abs/2606.18503,Quantum Annealing Enhanced Reinforcement Learning for Accurate Remaining Useful Lifetime Prediction,arxiv,stat
2026-06-18,https://arxiv.org/abs/2606.18509,Concept Modulation Models: A Unified Framework for Identifiability and Extrapolation,arxiv,stat
2026-06-18,https://arxiv.org/abs/2606.18512,Causal Forecasting in Panel Data: A Two-Way Synthetic Forecasting Approach,arxiv,stat
2026-06-18,https://arxiv.org/abs/2606.18515,Exponentially many initializations to avoid barren plateaus,arxiv,stat
2026-06-18,https://arxiv.org/abs/2606.18520,Compact Geometric Representations of Hierarchies,arxiv,stat
2026-06-18,https://arxiv.org/abs/2606.18527,Toward Simultaneously Optimal Regret in U-Calibration,arxiv,stat
2026-06-18,https://arxiv.org/abs/2606.18531,When Does Trajectory-Level Supervision Permit Efficient Offline Reinforcement Learning?,arxiv,stat
2026-06-18,https://arxiv.org/abs/2606.18535,Shrinkage priors for Bayesian Substitute Confounders,arxiv,stat
2026-06-18,https://arxiv.org/abs/2606.18538,Effects of sparsity and superposition on loss in simple autoencoders,arxiv,stat
2026-06-18,https://arxiv.org/abs/2606.18539,TS-Fault: Benchmarking Time Series Forecasters Against Structural Faults,arxiv,stat
2026-06-18,https://arxiv.org/abs/2606.18567,Bridging Data Gaps in Structural Fragility Modeling through Transfer Learning: Methodology and Case Studies,arxiv,stat
2026-06-18,https://arxiv.org/abs/2606.18611,QC-GAN: A Parameter-Efficient Quaternion Conformer GAN for High-Fidelity Speech Enhancement,arxiv,stat
2026-06-18,https://arxiv.org/abs/2606.18729,TimeLAVA: Learning-Agnostic Data Valuation for Time Series,arxiv,stat
2026-06-18,https://arxiv.org/abs/2606.18778,Online Distributional Prediction via Latent Cluster Geometry Under Drift and Corruption,arxiv,stat
2026-06-18,https://arxiv.org/abs/2606.18809,Applying the Weibull Shape Parameter test for signal detection in pharmacovigilance using the R package WSPsignal,arxiv,stat
2026-06-18,https://arxiv.org/abs/2606.18843,Improved prediction of extreme random effects in joint models: WRaPs,arxiv,stat
2026-06-18,https://arxiv.org/abs/2606.18853,Kernel of Partition Paths: A Unified Representation for Tree Ensembles,arxiv,stat
2026-06-18,https://arxiv.org/abs/2606.18867,Strategic Feature Selection,arxiv,stat
2026-06-18,https://arxiv.org/abs/2606.18933,Zero-Shot Active Feature Acquisition via LLM-Elicitation,arxiv,stat
2026-06-18,https://arxiv.org/abs/2606.18949,Feature Screening for High-Dimensional Structural Break Predictive Regression,arxiv,stat
2026-06-18,https://arxiv.org/abs/2606.18969,Balanced Twins: Causal Inference on Time Series with Hidden Confounding,arxiv,stat
2026-06-18,https://arxiv.org/abs/2606.18972,FOSC-X: An Extended Framework for Optimal Local Cuts and Non-Horizontal Cluster Selection from Clustering Hierarchies,arxiv,stat
2026-06-18,https://arxiv.org/abs/2606.18993,Sequential Kernel-based Conditional Independence Testing via Adaptive Betting,arxiv,stat
2026-06-18,https://arxiv.org/abs/2606.19011,Dimension reduction of multivariate densities in Bayes spaces,arxiv,stat
2026-06-18,https://arxiv.org/abs/2606.19041,Efficient Cumulative Incidence Estimation in Biobank Studies Using All Prevalent and Incident Events,arxiv,stat
2026-06-18,https://arxiv.org/abs/2606.19044,smoothbp: Fast Bayesian Hierarchical Piecewise Regression with Smoothed Transitions and Spike-and-Slab Model Selection,arxiv,stat
2026-06-18,https://arxiv.org/abs/2606.19057,Quantifying and Auditing LLM Evaluation via Positive--Unlabeled Learning,arxiv,stat
2026-06-18,https://arxiv.org/abs/2606.19065,Regularized covariance estimation from partially observed interferometric data,arxiv,stat
2026-06-18,https://arxiv.org/abs/2606.19084,Optimal score function estimation via derivatives constraints,arxiv,stat
2026-06-18,https://arxiv.org/abs/2606.19086,Probability Bound Analysis for Dependence Uncertainty in Risk and Decision Models,arxiv,stat
2026-06-18,https://arxiv.org/abs/2606.19087,What does ethnic density represent? Spatial co-occurrence networks of a widely used contextual measure using harmonised UK small-area census data,arxiv,stat
2026-06-18,https://arxiv.org/abs/2606.19105,Smoothness-Based Derandomization of PAC-Bayes Bounds,arxiv,stat
2026-06-18,https://arxiv.org/abs/2606.19117,Wasserstein Policy Learning for Distributional Outcomes,arxiv,stat
2026-06-18,https://arxiv.org/abs/2606.19125,Continuous-Speech Parkinson's Disease Detection Using Acoustic and Inharmonicity Features,arxiv,stat
2026-06-18,https://arxiv.org/abs/2606.19138,INDEQS: Informed Neural controlled Differential EQuationS,arxiv,stat
2026-06-18,https://arxiv.org/abs/2606.19147,On Local Population-Risk Certificates,arxiv,stat
2026-06-18,https://arxiv.org/abs/2606.19179,Compute Efficiency and Serial Runtime Tradeoffs for Stochastic Momentum Methods,arxiv,stat
2026-06-18,https://arxiv.org/abs/2606.19212,Generalised Eigenvalue Geometry of Semantic Adversarial Attacks,arxiv,stat
2026-06-18,https://arxiv.org/abs/2606.19230,A Human-in-the-Loop Bayesian Optimization Framework for Constraint-Aware Bioprocess Development,arxiv,stat
2026-06-18,https://arxiv.org/abs/2204.14224,Investigation of Neural Network Methods for Reconstruction and Classification of Texture Images Under Conditions of Incomplete Information,arxiv,cs
2026-06-18,https://arxiv.org/abs/2209.01378,RNN(p) for Power Consumption Forecasting,arxiv,cs
2026-06-18,https://arxiv.org/abs/2303.18031,Simple Domain Generalization Methods are Strong Baselines for Open Domain Generalization,arxiv,cs
2026-06-18,https://arxiv.org/abs/2307.05623,A DeepLearning Framework for Dynamic Estimation of Origin-Destination Sequence,arxiv,cs
2026-06-18,https://arxiv.org/abs/2310.05753,Large-Scale OD Matrix Estimation with A Deep Learning Method,arxiv,cs
2026-06-18,https://arxiv.org/abs/2402.08128,Recursive Joint Simulation in Games,arxiv,cs
2026-06-18,https://arxiv.org/abs/2406.07775,Self-attention-based non-linear basis transformations for compact latent space modelling of dynamic optical fibre transmission matrices,arxiv,cs
2026-06-18,https://arxiv.org/abs/2407.18245,VGGHeads: 3D Multi Head Alignment with a Large-Scale Synthetic Dataset,arxiv,cs
2026-06-18,https://arxiv.org/abs/2409.03500,Quality Perceptions and Intended Engagement in Response to AI-Generated and AI-Assisted News,arxiv,cs
2026-06-18,https://arxiv.org/abs/2410.21258,Provable quantum speedups for computing persistence in topological data analysis,arxiv,cs
2026-06-18,https://arxiv.org/abs/2411.16206,Scalable Batch Bayesian Optimization Via Subspace Acquisition Functions,arxiv,cs
2026-06-18,https://arxiv.org/abs/2412.16468,The Road to Artificial SuperIntelligence: A Comprehensive Survey of Superalignment,arxiv,cs
2026-06-18,https://arxiv.org/abs/2501.02874,Steering Flexible Linear Objects in Planar Environments by Two Robot Hands Using Euler's Elastica Solutions,arxiv,cs
2026-06-18,https://arxiv.org/abs/2501.06348,"Why Automate This? Exploring Correlations Between Desire for Robotic Automation, Invested Time and Well-Being",arxiv,cs
2026-06-18,https://arxiv.org/abs/2502.07531,"VidCRAFT3: Camera, Object, and Lighting Control for Image-to-Video Generation",arxiv,cs
2026-06-18,https://arxiv.org/abs/2502.10239,Efficient Zeroth-Order Federated Finetuning of Language Models on Resource-Constrained Devices,arxiv,cs
2026-06-18,https://arxiv.org/abs/2502.17748,FinP: Fairness-in-Privacy in Federated Learning by Addressing Disparities in Privacy Risk,arxiv,cs
2026-06-18,https://arxiv.org/abs/2503.01805,Depth-Width tradeoffs in Algorithmic Reasoning of Graph Tasks with Transformers,arxiv,cs
2026-06-18,https://arxiv.org/abs/2503.08038,Generalized Kullback-Leibler Divergence Loss,arxiv,cs
2026-06-18,https://arxiv.org/abs/2503.08895,Mutual Adaptation in Human-Robot Co-Transportation with Human Preference Uncertainty,arxiv,cs
2026-06-18,https://arxiv.org/abs/2504.04739,UST-GNN: A Unified Spatial--Topological Graph Neural Network Framework for Urban Analytics--Demonstrated through a Case Study on Urban Health Prediction,arxiv,cs
2026-06-18,https://arxiv.org/abs/2504.14798,RUB: Evaluating Residual Knowledge in Unlearned Models,arxiv,cs
2026-06-18,https://arxiv.org/abs/2505.03646,Revealing Hidden Vulnerabilities in Autoencoders through Gradient Signal Restoration,arxiv,cs
2026-06-18,https://arxiv.org/abs/2505.12369,Fully Geometric Multi-Hop Reasoning on Knowledge Graphs with Transitive Relations,arxiv,cs
2026-06-18,https://arxiv.org/abs/2505.16057,Signals of Provenance: Practices & Challenges of Navigating Indicators in AI-Generated Media for Sighted and Blind Individuals,arxiv,cs
2026-06-18,https://arxiv.org/abs/2505.21954,Revisiting Active Speaker Detection: An In-the-Wild Benchmark for Generalization and Robustness,arxiv,cs
2026-06-18,https://arxiv.org/abs/2505.23851,ASyMOB: Algebraic Symbolic Mathematical Operations Benchmark,arxiv,cs
2026-06-18,https://arxiv.org/abs/2506.08764,On the Stability of the Jacobian Matrix in Deep Neural Networks,arxiv,cs
2026-06-18,https://arxiv.org/abs/2506.09046,Self-Evolving Multi-Agent Systems via Textual Backpropagation,arxiv,cs
2026-06-18,https://arxiv.org/abs/2506.11139,Grids Often Outperform Implicit Neural Representations at Compressing Dense Signals,arxiv,cs
2026-06-18,https://arxiv.org/abs/2506.13196,KEPLA: A Knowledge-Enhanced Deep Learning Framework for Accurate Protein-Ligand Binding Affinity Prediction,arxiv,cs
2026-06-18,https://arxiv.org/abs/2506.14126,From Memorization to Parameter Interference: How Overtraining Experts Harms Model Merging,arxiv,cs
2026-06-18,https://arxiv.org/abs/2506.15066,ChatModel: Automating Reference Model Design and Verification with LLMs,arxiv,cs
2026-06-18,https://arxiv.org/abs/2507.01414,Decomposing Prediction Mechanisms for In-Context Recall,arxiv,cs
2026-06-18,https://arxiv.org/abs/2507.04219,Model Collapse Is Not a Bug but a Feature in Machine Unlearning for LLMs,arxiv,cs
2026-06-18,https://arxiv.org/abs/2507.16859,Enhancing Fatigue Detection through Heterogeneous Multi-Source Data Integration and Cross-Domain Modality Imputation,arxiv,cs
2026-06-18,https://arxiv.org/abs/2507.17786,Reinforcement Learning for Accelerated Aerodynamic Shape Optimisation,arxiv,cs
2026-06-18,https://arxiv.org/abs/2507.23644,Agents Trusting Agents? Restoring Lost Capabilities with Inclusive Healthcare,arxiv,cs
2026-06-18,https://arxiv.org/abs/2508.02158,Robust Detection of Planted Subgraphs in Semi-Random Models,arxiv,cs
2026-06-18,https://arxiv.org/abs/2508.03483,When Cars Have Stereotypes: Auditing Demographic Bias in Objects from Text-to-Image Models,arxiv,cs
2026-06-18,https://arxiv.org/abs/2508.09191,From Values to Tokens: An LLM-Driven Framework for Context-aware Time Series Forecasting via Symbolic Discretization,arxiv,cs
2026-06-18,https://arxiv.org/abs/2508.10178,Estimating carbon pools in the European Shelf sea environment: replacing reanalysis by model-informed machine learning?,arxiv,cs
2026-06-18,https://arxiv.org/abs/2508.20330,FORGE: Foundational Optimization Representations from Graph Embeddings,arxiv,cs
2026-06-18,https://arxiv.org/abs/2508.21720,PosterForest: Hierarchical Multi-Agent Collaboration for Scientific Poster Generation,arxiv,cs
2026-06-18,https://arxiv.org/abs/2509.02555,Surrogate Benchmarks for Model Merging Optimization,arxiv,cs
2026-06-18,https://arxiv.org/abs/2509.03734,How fast can you find a good hypothesis?,arxiv,cs
2026-06-18,https://arxiv.org/abs/2509.22020,Task-Adaptive Parameter-Efficient Fine-Tuning for Weather Foundation Models,arxiv,cs
2026-06-18,https://arxiv.org/abs/2509.22363,Investigating Faithfulness in Large Audio Language Models,arxiv,cs
2026-06-18,https://arxiv.org/abs/2510.04120,"Probing Semantic Alignment, Lexical Invariance, and Syntactic Influence in LLM Metaphor Processing",arxiv,cs
2026-06-18,https://arxiv.org/abs/2510.05107,Structured Cognitive Loop for Behavioral Intelligence in Large Language Model Agents (Extended Revision: From Behavioral Architecture to Epistemic Accountability),arxiv,cs
2026-06-18,https://arxiv.org/abs/2510.09905,The Personalization Trap: How User Memory Alters Emotional Reasoning in LLMs,arxiv,cs
2026-06-18,https://arxiv.org/abs/2510.15551,Rethinking Cross-lingual Gaps from a Statistical Viewpoint,arxiv,cs
2026-06-18,https://arxiv.org/abs/2510.18085,R2BC: Multi-Agent Imitation Learning from Single-Agent Demonstrations,arxiv,cs
2026-06-18,https://arxiv.org/abs/2510.27353,An In-depth Study of LLM Contributions to the Bin Packing Problem,arxiv,cs
2026-06-18,https://arxiv.org/abs/2511.00802,GrowthHacker: Automated Off-Policy Evaluation Optimization Using Code-Modifying LLM Agents,arxiv,cs
2026-06-18,https://arxiv.org/abs/2511.02036,TurboMap: GPU-Accelerated Local Mapping for Visual SLAM,arxiv,cs
2026-06-18,https://arxiv.org/abs/2511.05221,ActiTect: A Generalizable Machine Learning Pipeline for REM Sleep Behavior Disorder Screening through Standardized Actigraphy,arxiv,cs
2026-06-18,https://arxiv.org/abs/2511.14555,"DecNefSimulator: A Modular, Interpretable Framework for Decoded Neurofeedback Simulation Using Generative Models",arxiv,cs
2026-06-18,https://arxiv.org/abs/2511.19468,"Towards a future space-based, highly scalable AI infrastructure system design",arxiv,cs
2026-06-18,https://arxiv.org/abs/2511.20002,Semantic Router: On the Feasibility of Hijacking MLLMs via a Single Adversarial Perturbation,arxiv,cs
2026-06-18,https://arxiv.org/abs/2512.04144,RippleBench: Capturing Ripple Effects Using Existing Knowledge Repositories,arxiv,cs
2026-06-18,https://arxiv.org/abs/2512.09185,Learning Patient-Specific Disease Dynamics with Latent Flow Matching for Longitudinal Imaging Generation,arxiv,cs
2026-06-18,https://arxiv.org/abs/2512.11736,Bench-Push: Benchmarking Pushing-based Navigation and Manipulation Tasks for Mobile Robots,arxiv,cs
2026-06-18,https://arxiv.org/abs/2512.12850,KANEL\'E: Kolmogorov-Arnold Networks for Efficient LUT-based Evaluation,arxiv,cs
2026-06-18,https://arxiv.org/abs/2512.14428,Odyssey: An Automotive Lidar-Inertial Odometry Dataset with GNSS-denied situations,arxiv,cs
2026-06-18,https://arxiv.org/abs/2512.21109,Robust and Efficient MuJoCo-based Model Predictive Control via Web of Affine Spaces Derivatives,arxiv,cs
2026-06-18,https://arxiv.org/abs/2601.00567,Improving Scientific Document Retrieval with Academic Concept Index,arxiv,cs
2026-06-18,https://arxiv.org/abs/2601.07052,RSLCPP -- Deterministic Simulations Using ROS 2,arxiv,cs
2026-06-18,https://arxiv.org/abs/2601.12805,SciHorizon-GENE: Benchmarking LLM for Life Sciences Inference from Gene Knowledge to Functional Understanding,arxiv,cs
2026-06-18,https://arxiv.org/abs/2601.14288,DeepInflation: an AI agent for research and model discovery of inflation,arxiv,cs
2026-06-18,https://arxiv.org/abs/2601.14968,InstructTime++: Time Series Classification with Multimodal Language Modeling via Implicit Feature Enhancement,arxiv,cs
2026-06-18,https://arxiv.org/abs/2601.17226,"Retell, Reward, Repeat: Reinforcement Learning for Narrative Theory-Informed Story Retelling",arxiv,cs
2026-06-18,https://arxiv.org/abs/2601.20361,TINNs: Time-Induced Neural Networks for Solving Time-Dependent PDEs,arxiv,cs
2026-06-18,https://arxiv.org/abs/2601.20381,STORM: Slot-based Task-aware Object-centric Representation for robotic Manipulation,arxiv,cs
2026-06-18,https://arxiv.org/abs/2601.21626,HeRo-Q: A General Framework for Stable Low Bit Quantization via Hessian Conditioning,arxiv,cs
2026-06-18,https://arxiv.org/abs/2601.23018,Integrating Multi-Label Classification and Generative AI for Scalable Analysis of User Feedback,arxiv,cs
2026-06-18,https://arxiv.org/abs/2602.00161,LLM Compression by Block Removal with Constrained Binary Optimization,arxiv,cs
2026-06-18,https://arxiv.org/abs/2602.00176,Posterior Continuation with Noise-Conditioned Frequency Exposure for Diffusion Inverse Problems,arxiv,cs
2026-06-18,https://arxiv.org/abs/2602.01700,Tilt-Ropter: A Fully Actuated Hybrid Aerial-Terrestrial Vehicle with Tilt Rotors and Passive Wheels,arxiv,cs
2026-06-18,https://arxiv.org/abs/2602.04401,Quantile Transfer for Reliable Operating Point Selection in Visual Place Recognition,arxiv,cs
2026-06-18,https://arxiv.org/abs/2602.06470,Improve Large Language Model Systems with User Logs,arxiv,cs
2026-06-18,https://arxiv.org/abs/2602.06774,Towards Understanding What State Space Models Learn About Code,arxiv,cs
2026-06-18,https://arxiv.org/abs/2602.09234,Do Neural Networks Lose Plasticity in a Gradually Changing World?,arxiv,cs
2026-06-18,https://arxiv.org/abs/2602.11467,PRISM: A 3D Probabilistic Neural Representation for Interpretable Shape Modeling,arxiv,cs
2026-06-18,https://arxiv.org/abs/2602.15851,Narrative Theory-Driven LLM Methods for Automatic Story Generation and Understanding: A Survey,arxiv,cs
2026-06-18,https://arxiv.org/abs/2602.19591,Detecting High-Potential SMEs with Heterogeneous Graph Neural Networks,arxiv,cs
2026-06-18,https://arxiv.org/abs/2602.22222,TWICE: Modeling the Temporal Evolution of Personalized User Behavior via Event-Driven Agents,arxiv,cs
2026-06-18,https://arxiv.org/abs/2602.23092,Enhancing CVRP Solver through LLM-driven Automatic Heuristic Design,arxiv,cs
2026-06-18,https://arxiv.org/abs/2603.00026,ActMem: Bridging the Gap Between Memory Retrieval and Reasoning in LLM Agents,arxiv,cs
2026-06-18,https://arxiv.org/abs/2603.00656,InfoPO: Information-Driven Policy Optimization for User-Centric Agents,arxiv,cs
2026-06-18,https://arxiv.org/abs/2603.01221,"Epistemic Gain, Aleatoric Cost: Uncertainty Decomposition in Multi-Agent Debate for Math Reasoning",arxiv,cs
2026-06-18,https://arxiv.org/abs/2603.10718,Riemannian MeanFlow for One-Step Generation on Manifolds,arxiv,cs
2026-06-18,https://arxiv.org/abs/2603.10827,Speaker Verification with Speech-Aware LLMs: Evaluation and Augmentation,arxiv,cs
2026-06-18,https://arxiv.org/abs/2603.11417,Zero-Shot Cross-City Generalization in End-to-End Autonomous Driving: Self-Supervised versus Supervised Representations,arxiv,cs
2026-06-18,https://arxiv.org/abs/2603.15988,Something from Nothing: Data Augmentation for Robust Severity Level Estimation of Dysarthric Speech,arxiv,cs
2026-06-18,https://arxiv.org/abs/2603.28707,A Convex Route to Thermoelasticity: Learning Internal Energy and Dissipation,arxiv,cs
2026-06-18,https://arxiv.org/abs/2603.29247,MemRerank: Preference Memory for Personalized Product Reranking,arxiv,cs
2026-06-18,https://arxiv.org/abs/2604.00730,A CEFR-Inspired Classification Framework with Fuzzy C-Means To Automate Assessment of Programming Skills in Scratch,arxiv,cs
2026-06-18,https://arxiv.org/abs/2604.03208,Hierarchical Planning with Latent World Models,arxiv,cs
2026-06-18,https://arxiv.org/abs/2604.03275,IPSL-AID: Generative Diffusion Models for Climate Downscaling from Global to Regional Scales,arxiv,cs
2026-06-18,https://arxiv.org/abs/2604.06367,WebSP-Eval: Evaluating Web Agents on Website Security and Privacy Tasks,arxiv,cs
2026-06-18,https://arxiv.org/abs/2604.13082,The Long Delay to Arithmetic Generalization: When Learned Representations Outrun Behavior,arxiv,cs
2026-06-18,https://arxiv.org/abs/2604.14906,Unraveling the Mechanism of Drug Binding to SARS-CoV-2 RNA Pseudoknot with Thermodynamics-Driven Machine Learning,arxiv,cs
2026-06-18,https://arxiv.org/abs/2604.20822,Global Offshore Wind Infrastructure: Deployment and Operational Dynamics from Dense Sentinel-1 Time Series,arxiv,cs
2026-06-18,https://arxiv.org/abs/2604.22476,All Eyes on the Workflow: Automated and Efficient Event Discovery from Video Streams,arxiv,cs
