date,url,title,source,category
2026-06-15,https://arxiv.org/abs/2606.14492,Recipe-Controlled Decoder Audit for Structural Knowledge-Graph Completion,arxiv,cs
2026-06-15,https://arxiv.org/abs/2606.14498,A Fixed-Point Neural Operator for Size- and Functional-Transferable Hamiltonian Prediction,arxiv,cs
2026-06-15,https://arxiv.org/abs/2606.14502,From Chatbot to Digital Colleague: The Paradigm Shift Toward Persistent Autonomous AI,arxiv,cs
2026-06-15,https://arxiv.org/abs/2606.14507,Dense Coordinate-List Fine-Tuning Induces a Controllable Interference Surface in Vision-Language Models,arxiv,cs
2026-06-15,https://arxiv.org/abs/2606.14510,PepALD: Macrocyclic Peptide Generation via Autoregressive Latent Diffusion,arxiv,cs
2026-06-15,https://arxiv.org/abs/2606.14512,Fodor and Pylyshyn's Systematicity Challenge Still Stands,arxiv,cs
2026-06-15,https://arxiv.org/abs/2606.14515,Securing the Future of IoMT in the Post-Quantum Era: An Edge-Native Federated Learning Approach,arxiv,cs
2026-06-15,https://arxiv.org/abs/2606.14516,Every Eval Ever: A Unifying Schema and Community Repository for AI Evaluation Results,arxiv,cs
2026-06-15,https://arxiv.org/abs/2606.14517,From Shield to Target: Denial-of-Service Attacks on LLM-Based Agent Guardrails,arxiv,cs
2026-06-15,https://arxiv.org/abs/2606.14518,Behavioral Audit of Machine Unlearning Has a Privacy Cost,arxiv,cs
2026-06-15,https://arxiv.org/abs/2606.14530,Code Correctness Signals in LLM Hidden States: Pre-Generation Probing and Repair Geometry,arxiv,cs
2026-06-15,https://arxiv.org/abs/2606.14531,AERMANI-PLACE: Language Guided Object Placement with Aerial Manipulators,arxiv,cs
2026-06-15,https://arxiv.org/abs/2606.14533,The Risk Shadow of Principal Component Analysis: When 99.9999% Variance Preservation Causes Catastrophic Decision Errors,arxiv,cs
2026-06-15,https://arxiv.org/abs/2606.14535,Spatially Conditioned Diffusion Policy: Learning Precise and Robust Manipulation with a Single RGB Camera,arxiv,cs
2026-06-15,https://arxiv.org/abs/2606.14536,"Provably Safe, Yet Scalable Reinforcement Learning",arxiv,cs
2026-06-15,https://arxiv.org/abs/2606.14551,TRACE: Trajectory-Routed Causal Memory for Delayed-Evidence Visuomotor Imitation,arxiv,cs
2026-06-15,https://arxiv.org/abs/2606.14555,Rethinking Global Average Pooling: Your Classifier Is Secretly a Multi-Instance Learner,arxiv,cs
2026-06-15,https://arxiv.org/abs/2606.14561,ORCA: A Platform for Open-Source Dexterity Research,arxiv,cs
2026-06-15,https://arxiv.org/abs/2606.14562,NEST3D: A High-Resolution Multimodal Dataset of Sociable Weaver Tree Nests,arxiv,cs
2026-06-15,https://arxiv.org/abs/2606.14565,CANN-EUCLID: unsupervised constitutive artificial neural network model discovery from full-field data,arxiv,cs
2026-06-15,https://arxiv.org/abs/2606.14570,Regional Climate Model Emulation with Diffusion Approaches: What is the Added Value of Generative Machine Learning?,arxiv,cs
2026-06-15,https://arxiv.org/abs/2606.14571,StreamMemBench: Streaming Evaluation of Agent Memory for Future-Oriented Assistance,arxiv,cs
2026-06-15,https://arxiv.org/abs/2606.14574,SIMMER: Benchmarking Latent Failures in LLM Executable Planning with a World Model,arxiv,cs
2026-06-15,https://arxiv.org/abs/2606.14579,VISTA: View-Consistent Self-Verified Training for GUI Grounding,arxiv,cs
2026-06-15,https://arxiv.org/abs/2606.14581,CARE: Controlling LLM-Generated Policies through Auditable Review of Evidence in Scientific Experimentation,arxiv,cs
2026-06-15,https://arxiv.org/abs/2606.14582,A Temporal Planning Framework for Disruption Aware Dynamic Route Optimization in Heterogeneous Railway Systems,arxiv,cs
2026-06-15,https://arxiv.org/abs/2606.14585,Sensitivity Shaping for Latent Modeling,arxiv,cs
2026-06-15,https://arxiv.org/abs/2606.14589,When Errors Become Narratives: A Longitudinal Taxonomy of Silent Failures in a Production LLM Agent Runtime,arxiv,cs
2026-06-15,https://arxiv.org/abs/2606.14591,AudioDER: A Deduplication-Enhanced Reasoning Dataset for Post-Training Large Audio-Language Models,arxiv,cs
2026-06-15,https://arxiv.org/abs/2606.14594,Regulating the Machine Contributor: Governance and Policy Alignment in Open Source,arxiv,cs
2026-06-15,https://arxiv.org/abs/2606.14597,Zero-shot generalization of transformer neural operators to larger domains,arxiv,cs
2026-06-15,https://arxiv.org/abs/2606.14598,Realizing Native INT8 Compute for Diffusion Transformers on Consumer GPUs: A Fused INT8 GEMM Kernel for Ideogram 4.0,arxiv,cs
2026-06-15,https://arxiv.org/abs/2606.14601,A Statistical and Machine Learning Framework for Operational Threshold Detection and Deployable Dispatch Controller Development in Hydrogen Multi-Energy Systems,arxiv,cs
2026-06-15,https://arxiv.org/abs/2606.14602,What Robots Do Matters More Than What They Look Like: Task Context Shapes Trust in Educational HRI,arxiv,cs
2026-06-15,https://arxiv.org/abs/2606.14604,A Comparative Study of Deep Learning Architectures for Multi-Horizon Behavioural Forecasting for Mobile Health,arxiv,cs
2026-06-15,https://arxiv.org/abs/2606.14606,Impedance MPC with Disturbance Estimation for Dexterous Hand Control,arxiv,cs
2026-06-15,https://arxiv.org/abs/2606.14608,Expert-Driven Survival Machines: Improving Stratification and Interpretability in Multiple Clinical Cohorts,arxiv,cs
2026-06-15,https://arxiv.org/abs/2606.14609,Safe Reinforcement Learning of Autonomous Highway Driving: A Unified Framework for Safety and Efficiency,arxiv,cs
2026-06-15,https://arxiv.org/abs/2606.14612,Moonlight in Latent Space: Chirality and Structural Correspondence Between Beethoven's Op. 27 No. 2 and Machine Learning Mechanisms,arxiv,cs
2026-06-15,https://arxiv.org/abs/2606.14617,Whole-Body Impedance Model Predictive Control for Safe Physical Human--Robot Interaction on Floating-Base Platforms,arxiv,cs
2026-06-15,https://arxiv.org/abs/2606.14620,Neither Parallel Nor Sequential: How DiffusionGemma Actually Commits Tokens,arxiv,cs
2026-06-15,https://arxiv.org/abs/2606.14629,When Good Verifiers Go Bad: Self-Improving VLMs Can Regress on New Tasks,arxiv,cs
2026-06-15,https://arxiv.org/abs/2606.14636,Graph Diffusion Residuals for Control-Function Instrumental Variables,arxiv,cs
2026-06-15,https://arxiv.org/abs/2606.14639,From Self-Supervised Speech Models to Mixture-of-Experts for Robust Anti-Spoofing,arxiv,cs
2026-06-15,https://arxiv.org/abs/2606.14640,Online Convex Optimization with Sublinear Noisy Probes,arxiv,cs
2026-06-15,https://arxiv.org/abs/2606.14647,Listening with Attention: Entropy-Guided Explainability for Transformer-Based Audio Models,arxiv,cs
2026-06-15,https://arxiv.org/abs/2606.14648,Which Directions Matter? Sparse Design for Affine Robust Optimization,arxiv,cs
2026-06-15,https://arxiv.org/abs/2606.14650,Graph Structured Combinatorial Semi-Bandit with Nonlinear Reward Associations through Separable Signals,arxiv,cs
2026-06-15,https://arxiv.org/abs/2606.14654,Abstracting Cross-Domain Action Sequences into Interpretable Workflows,arxiv,cs
2026-06-15,https://arxiv.org/abs/2606.14658,Giving AI a Headache: Acoustic Adversarial Attacks to Computer Vision Applications,arxiv,cs
2026-06-15,https://arxiv.org/abs/2606.14662,Beyond task performance: Decoding bioacoustic embeddings with speech features,arxiv,cs
2026-06-15,https://arxiv.org/abs/2606.14665,EgoGuide: Egocentric Guidance for Efficient Robot-Free Demonstration Collection and Learning,arxiv,cs
2026-06-15,https://arxiv.org/abs/2606.14668,When to Write and When to Suppress: Route-Specialized Dual Adapters for Memory-Assisted Knowledge Editing,arxiv,cs
2026-06-15,https://arxiv.org/abs/2606.14672,Towards Direct Latent-Space Synthesis for Parallel Branches in LLM-Agent Workflows,arxiv,cs
2026-06-15,https://arxiv.org/abs/2606.14673,Compressed Computation is (probably) not Computation in Superposition,arxiv,cs
2026-06-15,https://arxiv.org/abs/2606.14684,HumP-KD: A Hybrid Uncertainty-Aware Multi-Stage Progressive Knowledge Distillation Framework for Efficient Fire Classification,arxiv,cs
2026-06-15,https://arxiv.org/abs/2606.14686,CottonLeafVision: An Explainable and Robust Deep Learning Framework for Cotton Leaf Disease Classification,arxiv,cs
2026-06-15,https://arxiv.org/abs/2606.14688,Flood and Harvest: The Provable Necessity of Trivia for Generating Valuable Mathematics via the Lens of Language Generation in the Limit,arxiv,cs
2026-06-15,https://arxiv.org/abs/2606.14690,A Complexity Measure for Active Learning in Multi-group Mean Estimation,arxiv,cs
2026-06-15,https://arxiv.org/abs/2606.14693,Learning Coordinated Preference for Multi-Objective Multi-Agent Reinforcement Learning,arxiv,cs
2026-06-15,https://arxiv.org/abs/2606.14695,Persona-Pruner: Sculpting Lightweight Models for Role-Playing,arxiv,cs
2026-06-15,https://arxiv.org/abs/2606.14697,ClinHallu: A Benchmark for Diagnosing Stage-Wise Hallucinations in Medical MLLM Reasoning,arxiv,cs
2026-06-15,https://arxiv.org/abs/2606.14699,Instruct-Particulate: Scaling Feed-Forward 3D Object Articulation with Kinematic Control,arxiv,cs
2026-06-15,https://arxiv.org/abs/2606.14703,Gaze Heads: How VLMs Look at What They Describe,arxiv,cs
2026-06-15,https://arxiv.org/abs/2504.00701,Towards turnpike-based performance analysis of risk-averse stochastic predictive control,arxiv,math
2026-06-15,https://arxiv.org/abs/2504.13006,Mathematical programs with complementarity constraints and application to hyperparameter tuning,arxiv,math
2026-06-15,https://arxiv.org/abs/2506.16321,Making Non-Negative Polynomials into Sums of Squares,arxiv,math
2026-06-15,https://arxiv.org/abs/2509.20145,Leaf It to Renewal: Improved Predictive Maintenance Policies via Renewal Theory and Decision Trees,arxiv,math
2026-06-15,https://arxiv.org/abs/2511.02153,A Joint Variational Framework for Multimodal X-ray Ptychography and Fluorescence Reconstruction,arxiv,math
2026-06-15,https://arxiv.org/abs/2601.16683,Projected Gradient Methods with Momentum,arxiv,math
2026-06-15,https://arxiv.org/abs/2603.18703,Stabilization of Integral Difference Equations by Solving a Corona Problem,arxiv,math
2026-06-15,https://arxiv.org/abs/2606.13897,Delay-dependent passivity and stability of linear port-Hamiltonian systems,arxiv,math
2026-06-15,https://arxiv.org/abs/2606.13903,Degree-Four Vector-Coordinate SoS Cannot Detect the MUB Upper Bound,arxiv,math
2026-06-15,https://arxiv.org/abs/2606.13987,Proof and More Variations of Bellman's Lost-in-a-forest Problem,arxiv,math
2026-06-15,https://arxiv.org/abs/2606.14041,A Semismooth Newton-Based Proximal Augmented Lagrangian Method for Joint Estimation of Multiple Gaussian Graphical Models with Clustered Structure,arxiv,math
2026-06-15,https://arxiv.org/abs/2606.14050,Battery Bidding under Price Uncertainty in Wholesale Electricity Markets,arxiv,math
2026-06-15,https://arxiv.org/abs/2606.14128,Designing Efficient and Reachable Routes: The $k$-Step-Central Shortest Path Problem,arxiv,math
2026-06-15,https://arxiv.org/abs/2606.14220,A New Primal-Dual Algorithm with Convex Combination and Extrapolation for Convex-Concave Saddle Point Problems with Nonlinear Coupling Term,arxiv,math
2026-06-15,https://arxiv.org/abs/2606.14410,A simulation study on spatial exponential decay of perturbations in a two-dimensional wave equation with optimal boundary/line control,arxiv,math
2026-06-15,https://arxiv.org/abs/2606.14471,A Generalized Plant Perspective on Linear-Convex Feedback Optimization,arxiv,math
2026-06-15,https://arxiv.org/abs/2606.14500,Local convergence of Sussmann's infinite product for analytic vector fields,arxiv,math
2026-06-15,https://arxiv.org/abs/2606.14687,"Lehner's operator norm formulas, semidefinite programming, and spiked matrix models",arxiv,math
2026-06-16,https://arxiv.org/abs/2112.07755,Separate Exchangeability as Modeling Principle in Bayesian Nonparametrics,arxiv,stat
2026-06-16,https://arxiv.org/abs/2207.05190,Estimation of High-Dimensional Normal Means through Inferential Models,arxiv,stat
2026-06-16,https://arxiv.org/abs/2302.14505,Nonlinear regression models to forecast PM$_{2.5}$ concentration,arxiv,stat
2026-06-16,https://arxiv.org/abs/2306.02244,KL-BSS: Rethinking optimality for neighbourhood selection in structural equation models,arxiv,stat
2026-06-16,https://arxiv.org/abs/2312.01265,The optimal sub-Gaussian normalisation for randomised monotone functions,arxiv,stat
2026-06-16,https://arxiv.org/abs/2401.14283,Information Leakage Detection through Approximate Bayes-optimal Prediction,arxiv,stat
2026-06-16,https://arxiv.org/abs/2405.15768,Canonical Variates in Wasserstein Metric Space,arxiv,stat
2026-06-16,https://arxiv.org/abs/2407.09964,TrIM: Transformed Iterative Mondrian Forests for Gradient-based Dimension Reduction and High-Dimensional Regression,arxiv,stat
2026-06-16,https://arxiv.org/abs/2409.18909,Best Arm Identification with Minimal Regret,arxiv,stat
2026-06-16,https://arxiv.org/abs/2412.17470,A Necessary and Sufficient Condition for Size Controllability of Heteroskedasticity Robust Test Statistics,arxiv,stat
2026-06-16,https://arxiv.org/abs/2412.20316,A Rank-Based Test for Comparing Multiple Fields' Yield Quality Distributions Under Spatial Dependence,arxiv,stat
2026-06-16,https://arxiv.org/abs/2501.19401,DAL: A Practical Prior-Free Black-Box Framework for Piecewise Stationary Bandits,arxiv,stat
2026-06-16,https://arxiv.org/abs/2502.07396,Optimality in importance sampling: a gentle survey,arxiv,stat
2026-06-16,https://arxiv.org/abs/2502.10182,Scalable Generalised Accuracy Estimation for Multisource Register-based Official Statistics,arxiv,stat
2026-06-16,https://arxiv.org/abs/2502.12445,Computational Safety for Generative AI: A Hypothesis Testing Perspective,arxiv,stat
2026-06-16,https://arxiv.org/abs/2504.11320,Optimizing LLM Inference: Fluid-Guided Online Scheduling with Memory Constraints,arxiv,stat
2026-06-16,https://arxiv.org/abs/2504.11775,Discrimination-free Insurance Pricing with Privatized Sensitive Attributes,arxiv,stat
2026-06-16,https://arxiv.org/abs/2505.03201,Enhancing Visual Feature Attribution via Weighted Integrated Gradients,arxiv,stat
2026-06-16,https://arxiv.org/abs/2505.06589,Optimal Transport for Machine Learners,arxiv,stat
2026-06-16,https://arxiv.org/abs/2505.24275,GradPower: Powering Gradients for Faster Language Model Pre-Training,arxiv,stat
2026-06-16,https://arxiv.org/abs/2506.00561,Mortality Forecasting under Climate Risk: A Stochastic Approach with Distributed Lag Non-Linear Models,arxiv,stat
2026-06-16,https://arxiv.org/abs/2506.08328,Diffusion Non-Additive Model for Multi-Fidelity Simulations with Tunable Precision,arxiv,stat
2026-06-16,https://arxiv.org/abs/2507.05689,Optimal structure learning and conditional independence testing,arxiv,stat
2026-06-16,https://arxiv.org/abs/2508.03867,Constraining the outputs of ReLU neural networks,arxiv,stat
2026-06-16,https://arxiv.org/abs/2508.08564,Kernel Two-Sample Testing via Directional Components Analysis,arxiv,stat
2026-06-16,https://arxiv.org/abs/2508.20278,Interpretable Scalar-on-Image Linear Regression Models via the Generalized Dantzig Selector,arxiv,stat
2026-06-16,https://arxiv.org/abs/2509.03945,Prob-GParareal: A Probabilistic Numerical Parallel-in-Time Solver for Differential Equations,arxiv,stat
2026-06-16,https://arxiv.org/abs/2509.21734,Optimal Stopping for Sequential Bayesian Experimental Design,arxiv,stat
2026-06-16,https://arxiv.org/abs/2509.24223,Semantic Editing with Coupled Stochastic Differential Equations,arxiv,stat
2026-06-16,https://arxiv.org/abs/2510.01175,On the Benefits of Weight Normalization for Overparameterized Matrix Sensing,arxiv,stat
2026-06-16,https://arxiv.org/abs/2510.06647,Q-Learning with Fine-Grained Gap-Dependent Regret,arxiv,stat
2026-06-16,https://arxiv.org/abs/2510.10981,In-Context Learning Is Provably Bayesian Inference: A Generalization Theory for Meta-Learning,arxiv,stat
2026-06-16,https://arxiv.org/abs/2510.13715,Exact Coordinate Descent for High-Dimensional Regularized Huber Regression,arxiv,stat
2026-06-16,https://arxiv.org/abs/2510.14092,deFOREST: Fusing Optical and Radar satellite data for Enhanced Sensing of Tree-loss,arxiv,stat
2026-06-16,https://arxiv.org/abs/2510.24043,Localized Kernel Projection Outlyingness: A Two-Stage Approach for Multi-Modal Outlier Detection,arxiv,stat
2026-06-16,https://arxiv.org/abs/2511.03954,Nonparametric Modeling of Continuous-Time Markov Chains,arxiv,stat
2026-06-16,https://arxiv.org/abs/2511.09465,"Branching Flows: Discrete, Continuous, and Manifold Flow Matching with Splits and Deletions",arxiv,stat
2026-06-16,https://arxiv.org/abs/2511.18553,Matching correlated VAR time series,arxiv,stat
2026-06-16,https://arxiv.org/abs/2512.08144,Propensity score adjustment when errors in achievement measures inform treatment assignment,arxiv,stat
2026-06-16,https://arxiv.org/abs/2512.12003,Debiased Inference for High-Dimensional Regression Models Based on Profile M-Estimation,arxiv,stat
2026-06-16,https://arxiv.org/abs/2512.20566,Random Gradient-Free Optimization in Infinite Dimensional Spaces,arxiv,stat
2026-06-16,https://arxiv.org/abs/2512.21577,"A Unified Definition of Hallucination: It's The World Model, Stupid!",arxiv,stat
2026-06-16,https://arxiv.org/abs/2601.04608,Forecasting the U.S. Treasury Yield Curve: A Distributionally Robust Machine Learning Approach for Interest Rate Risk Management,arxiv,stat
2026-06-16,https://arxiv.org/abs/2601.16470,Variational Dimension Lifting for Robust Tracking of Nonlinear Stochastic Dynamics,arxiv,stat
2026-06-16,https://arxiv.org/abs/2601.20875,"Drivers, Receivers, and Dynamic Linkages: The Directed Structure of SDG Interdependence, 2000--2024",arxiv,stat
2026-06-16,https://arxiv.org/abs/2602.00781,Fast Non-Episodic Finite-Horizon RL with K-Step Lookahead Thresholding,arxiv,stat
2026-06-16,https://arxiv.org/abs/2602.08026,Sharp analysis of linear ensemble sampling,arxiv,stat
2026-06-16,https://arxiv.org/abs/2602.08210,CADO: From Imitation to Cost Minimization for Heatmap-based Solvers in Combinatorial Optimization,arxiv,stat
2026-06-16,https://arxiv.org/abs/2602.17587,Asymptotically Optimal Sequential Testing with Markovian Data,arxiv,stat
2026-06-16,https://arxiv.org/abs/2602.18241,Online FDR Controlling procedures for statistical SIS Model and its application to COVID19 data,arxiv,stat
2026-06-16,https://arxiv.org/abs/2602.21068,Detecting Where Effects Occur by Testing Hypotheses in Order,arxiv,stat
2026-06-16,https://arxiv.org/abs/2603.00874,Detecting Distributional Differences in Spatially Correlated Multivariate Data via Kernel-Smoothed Rank-Based Empirical Copula Tests,arxiv,stat
2026-06-16,https://arxiv.org/abs/2603.12881,Multivariate lattice deformation: A spatially explicit framework for assessing crop rotation impacts on soil nutrient dynamics,arxiv,stat
2026-06-16,https://arxiv.org/abs/2604.18863,Overstuffed sandwiches and separation anxiety: finite-sample variance estimation for penalized GEE with near-separated binary data,arxiv,stat
2026-06-16,https://arxiv.org/abs/2604.23952,Conditional Score-Based Modeling of Effective Langevin Dynamics,arxiv,stat
2026-06-16,https://arxiv.org/abs/2604.26819,Sharp One-Dimensional Sub-Gaussian Comparison in Convex Order,arxiv,stat
2026-06-16,https://arxiv.org/abs/2605.03289,Imbalanced Classification under Capacity Constraints,arxiv,stat
2026-06-16,https://arxiv.org/abs/2605.03573,"Stochastic Schr\""odinger Diffusion Models for Pure-State Ensemble Generation",arxiv,stat
2026-06-16,https://arxiv.org/abs/2605.13092,Adaptive Kernel Density Estimation with Pre-training,arxiv,stat
2026-06-16,https://arxiv.org/abs/2605.18324,Improved Baselines with Representation Autoencoders,arxiv,stat
2026-06-16,https://arxiv.org/abs/2605.25855,High-Dimensional Robust Change-Point Detection via Angular Kernel Statistics,arxiv,stat
2026-06-16,https://arxiv.org/abs/2605.29641,Experimentation for Different Scheduling Policies on Queues: Mixed Differences-in-Q Estimators Based on Little's Law,arxiv,stat
2026-06-16,https://arxiv.org/abs/2606.14737,Arxiv Paper 2606.14737,arxiv,stat
2026-06-16,https://arxiv.org/abs/2606.14798,Two Sides of Schur Damping: High-Dimensional Pseudo-Likelihoods and Portfolio Allocation,arxiv,stat
2026-06-16,https://arxiv.org/abs/2606.14800,Bridging data-driven priors via the score function for posterior sampling -- Comparative review and experimental study,arxiv,stat
2026-06-16,https://arxiv.org/abs/2606.14837,Bartlett adjustment for Gaussian random effects meta-analysis,arxiv,stat
2026-06-16,https://arxiv.org/abs/2606.14840,Causal Sufficient Dimension Reduction for Multiple Continuous Exposures with an Application to Environmental Mixtures,arxiv,stat
2026-06-16,https://arxiv.org/abs/2606.14854,Arxiv Paper 2606.14854,arxiv,stat
2026-06-16,https://arxiv.org/abs/2606.14892,Arxiv Paper 2606.14892,arxiv,stat
2026-06-16,https://arxiv.org/abs/2606.14902,Heterogeneous behavioral mechanisms in epidemiological models,arxiv,stat
2026-06-16,https://arxiv.org/abs/2606.14909,Audited Conformal Prediction for Classification under Unknown Distribution Shift,arxiv,stat
2026-06-16,https://arxiv.org/abs/2606.14921,Flexible Method Comparison with the Probability of Agreement,arxiv,stat
2026-06-16,https://arxiv.org/abs/2606.14929,Arxiv Paper 2606.14929,arxiv,stat
2026-06-16,https://arxiv.org/abs/2606.14954,Arxiv Paper 2606.14954,arxiv,stat
2026-06-16,https://arxiv.org/abs/2606.15002,Decision Theory for the Archetype Discovery Problem,arxiv,stat
2026-06-16,https://arxiv.org/abs/2606.15012,A Kuramoto-von Mises Time Series Model for Probabilistic Modeling of Coupled Oscillators,arxiv,stat
2026-06-16,https://arxiv.org/abs/2606.15097,Separate versus pooled winsorization for group mean contrasts: a finite-sample theory,arxiv,stat
2026-06-16,https://arxiv.org/abs/2606.15145,On the estimation of the median odds ratio for measuring contextual effects in multilevel binary data from complex survey designs,arxiv,stat
2026-06-16,https://arxiv.org/abs/2606.15201,A Koopman-PINN Framework for Epidemic Models: Parameter Inference and Forecasting,arxiv,stat
2026-06-16,https://arxiv.org/abs/2606.15217,Conformal Candidate Certification for Offline Model-Based Optimization,arxiv,stat
2026-06-16,https://arxiv.org/abs/2606.15219,Can Neural Networks Achieve Optimal Computational-statistical Tradeoff? An Analysis on Single-Index Model,arxiv,stat
2026-06-16,https://arxiv.org/abs/2606.15237,Optimized Sequential Testing for Binary Ensemble Classifiers,arxiv,stat
2026-06-16,https://arxiv.org/abs/2606.15314,LLMs on Tabular Data with Limited Semantics: Evidence from Industrial Car Retrofit Prediction,arxiv,stat
2026-06-16,https://arxiv.org/abs/2606.15343,Arxiv Paper 2606.15343,arxiv,stat
2026-06-16,https://arxiv.org/abs/2606.15360,Generating-Element Maximum Entropy for Non-Gaussian Uncertainty Evaluation,arxiv,stat
2026-06-16,https://arxiv.org/abs/2606.15393,Finite Resources False Discovery Rate Control in Structured Hypothesis Spaces,arxiv,stat
2026-06-16,https://arxiv.org/abs/2606.15433,Arxiv Paper 2606.15433,arxiv,stat
2026-06-16,https://arxiv.org/abs/2606.15442,"The Reverse Telescoping Coordinate System for Positive Definite Matrices: Geometry, Computation, and Generative Modeling",arxiv,stat
2026-06-16,https://arxiv.org/abs/2606.15445,Interim Monitoring as an Information-Time Alignment Problem: The WCR Framework for Time-to-Event Trials,arxiv,stat
2026-06-16,https://arxiv.org/abs/2606.15450,Kernel Density Estimation by Spectral Decomposition: Data-Driven Tapering and Superposition,arxiv,stat
2026-06-16,https://arxiv.org/abs/2606.15452,PHINN: Persistent Homology Inspired Neural Network for Rare-Event Time Series Generation,arxiv,stat
2026-06-16,https://arxiv.org/abs/2606.15458,Structured Nonparametric Variational Inference for Dependent Latent Modeling,arxiv,stat
2026-06-16,https://arxiv.org/abs/2606.15478,A Bayesian Functional Accelerated Failure-Time Model with Varying Effects Correcting for Measurement Error,arxiv,stat
2026-06-16,https://arxiv.org/abs/2606.15482,Ricci-Filtration: Boosting Retrieval-Augmented Generation Reranker to Query-Answer Tasks by Discrete Ricci Flow,arxiv,stat
2026-06-16,https://arxiv.org/abs/2606.15525,Arxiv Paper 2606.15525,arxiv,stat
2026-06-16,https://arxiv.org/abs/2606.15526,Latent Variable Models for Distributional Features,arxiv,stat
2026-06-16,https://arxiv.org/abs/2606.15555,Service-Induced Congestion in Memory-Constrained LLM Serving,arxiv,stat
2026-06-16,https://arxiv.org/abs/2606.15569,"A Decision-Theoretic View of Test-Time Training: When, How Far, and Which Directions to Adapt",arxiv,stat
2026-06-16,https://arxiv.org/abs/2606.15581,Phase Transition in Convex Relaxations for Graph Alignment,arxiv,stat
2026-06-16,https://arxiv.org/abs/2606.15602,Bias-Aware External-Model-Assisted Inference in High-Dimensional Regression,arxiv,stat
2026-06-16,https://arxiv.org/abs/2606.15636,Paired Sample Tests for High-dimensional Uncorrelatedness via Random Integration,arxiv,stat
2026-06-16,https://arxiv.org/abs/2606.15665,Information Gap and Feasibility-Aware Inference in Binomial Logistic Mixtures,arxiv,stat
2026-06-16,https://arxiv.org/abs/2606.15679,Stochastic trace estimation with tensor train random vectors,arxiv,stat
2026-06-16,https://arxiv.org/abs/2606.15725,Score-Based Martingale Posteriors for Deep Neural Networks,arxiv,stat
2026-06-16,https://arxiv.org/abs/2606.15754,Bounding Causal Effects for Ordinal Outcomes Under Positive Dependence,arxiv,stat
2026-06-16,https://arxiv.org/abs/2606.15755,Arxiv Paper 2606.15755,arxiv,stat
2026-06-16,https://arxiv.org/abs/2606.15760,The Data Manifold under the Microscope,arxiv,stat
2026-06-16,https://arxiv.org/abs/2606.15793,Proximal Policy Optimization for Amortized Discrete Sampling,arxiv,stat
2026-06-16,https://arxiv.org/abs/2606.15836,Arxiv Paper 2606.15836,arxiv,stat
2026-06-16,https://arxiv.org/abs/2606.15837,Arxiv Paper 2606.15837,arxiv,stat
