date,url,title,source,category
2026-06-26,https://arxiv.org/abs/2606.27032,State Representation Matters in Deep Reinforcement Learning: Application to Energy Trading,arxiv,cs
2026-06-26,https://arxiv.org/abs/2606.27036,RelAfford6D: Relational 6D Affordance Graphs for Constraint-Driven Robotic Manipulation,arxiv,cs
2026-06-26,https://arxiv.org/abs/2606.27039,Scalability of Morality: A Particle-Based Numerical Study on the Decoupling of Law and Ethics in Large-Scale Populations,arxiv,cs
2026-06-26,https://arxiv.org/abs/2606.27045,"The Spec Growth Engine: Spec-Anchored, Code-Coupled, Drift-Enforced Architecture for AI-Assisted Software Development",arxiv,cs
2026-06-26,https://arxiv.org/abs/2606.27047,NuclearQAv2: A Structured Benchmark for Evaluating Domain-Science Competence in Large Language Models,arxiv,cs
2026-06-26,https://arxiv.org/abs/2606.27061,How to evaluate clustering with ground truth?,arxiv,cs
2026-06-26,https://arxiv.org/abs/2606.27068,Parametric Open Source Games,arxiv,cs
2026-06-26,https://arxiv.org/abs/2606.27079,ForesightSafety-VLA: A Unified Diagnostic Safety Benchmark for Vision-Language-Action Models,arxiv,cs
2026-06-26,https://arxiv.org/abs/2606.27082,Finding Stationary Points by Comparisons,arxiv,cs
2026-06-26,https://arxiv.org/abs/2606.27091,"Inherited Circuits, Learned Semantics: How Fine-Tuning Creates Evasion Vulnerabilities Invisible to Standard Evaluation",arxiv,cs
2026-06-26,https://arxiv.org/abs/2606.27095,Data-Free Reservoir Features for Efficient Long-Horizon Cold-Start Continual Learning,arxiv,cs
2026-06-26,https://arxiv.org/abs/2606.27096,Transformer-Based Classification of Bacterial Raman Spectra with LOOCV,arxiv,cs
2026-06-26,https://arxiv.org/abs/2606.27106,Application of LLMs to Threat Assessment of Foreign Peacekeeping Missions,arxiv,cs
2026-06-26,https://arxiv.org/abs/2606.27112,Heavy-Ball Q-Learning with Residual Weighting Correction,arxiv,cs
2026-06-26,https://arxiv.org/abs/2606.27114,Cross-Head Attention Uplift Network with Inverse Propensity Score under Unobserved Confounding,arxiv,cs
2026-06-26,https://arxiv.org/abs/2606.27119,Efficient foundation decoders for fault-tolerant quantum computing,arxiv,cs
2026-06-26,https://arxiv.org/abs/2606.27122,Mostly Automatic Translation of Language Interpreters from C to Safe Rust,arxiv,cs
2026-06-26,https://arxiv.org/abs/2606.27123,Proposal-Conditioned Latent Diffusion for Closed-Loop Traffic Scenario Generation,arxiv,cs
2026-06-26,https://arxiv.org/abs/2606.27126,Kolmogorov Arnold networks (KAN) for aerodynamic prediction: a comparison with MLPs and GNNs,arxiv,cs
2026-06-26,https://arxiv.org/abs/2606.27128,FlameVQA: A Physically-Grounded UAV Wildfire VQA Benchmark with Radiometric Thermal Supervision,arxiv,cs
2026-06-26,https://arxiv.org/abs/2606.27136,Joint Learning of Experiential Rules and Policies for Large Language Model Agents,arxiv,cs
2026-06-26,https://arxiv.org/abs/2606.27140,fTNN: a tensor neural network for fractional PDEs,arxiv,cs
2026-06-26,https://arxiv.org/abs/2606.27144,PAMAE: Phase-Aware-MoE Action Experts Towards Reliable Flow-Matching Vision-Language-Action Policies,arxiv,cs
2026-06-26,https://arxiv.org/abs/2606.27146,PhysReflect-VLA: Physical Feasibility and Self-Reflective Regulation for Reliable Vision-Language-Action Policies,arxiv,cs
2026-06-26,https://arxiv.org/abs/2606.27147,Safe Autoregressive Image Generation with Iterative Self-Improving Codebooks,arxiv,cs
2026-06-26,https://arxiv.org/abs/2606.27153,DMuon: Efficient Distributed Muon Training with Near-Adam Overhead,arxiv,cs
2026-06-26,https://arxiv.org/abs/2606.27154,OpenRCA 2.0: From Outcome Labels to Causal Process Supervision,arxiv,cs
2026-06-26,https://arxiv.org/abs/2606.27161,TOPS: First-Principles Visual Token Pruning via Constructing Token Optimal Preservation Sets for Efficient MLLM Inference,arxiv,cs
2026-06-26,https://arxiv.org/abs/2606.27163,"Learning to Fold: prizewinning solution at LeHome Challenge 2026 (1st place online, 2nd offline)",arxiv,cs
2026-06-26,https://arxiv.org/abs/2606.27174,RecallRisk-BERT: A Multi-Task Framework for Post-Report Medical Device Recall Triage,arxiv,cs
2026-06-26,https://arxiv.org/abs/2606.27180,Automating Potential-based Reward Shaping with Vision Language Model Guidance,arxiv,cs
2026-06-26,https://arxiv.org/abs/2606.27188,A Process Harness for Uplifting Legacy Workflows to Agentic BPM: Design and Realization in CUGA FLO,arxiv,cs
2026-06-26,https://arxiv.org/abs/2606.27199,Forecasting With LLMs: Improved Generalization Through Feature Steering,arxiv,cs
2026-06-26,https://arxiv.org/abs/2606.27201,Explaining Temporal Graph Neural Networks via Feature-induced Information Flow,arxiv,cs
2026-06-26,https://arxiv.org/abs/2606.27202,Graph Neural Networks Applications Across Domains: All Insights You Need,arxiv,cs
2026-06-26,https://arxiv.org/abs/2606.27215,Vulnerability of Natural Language Classifiers to Evolutionary Generated Adversarial Text,arxiv,cs
2026-06-26,https://arxiv.org/abs/2606.27216,Hierarchical Muon: Tiled Newton-Schulz Updates for Efficient Muon Optimization,arxiv,cs
2026-06-26,https://arxiv.org/abs/2606.27226,"Ask, Don't Judge: Binary Questions for Interpretable LLM Evaluation and Self-Improvement",arxiv,cs
2026-06-26,https://arxiv.org/abs/2606.27229,CARVE: Content-Aware Recurrent with Value Efficiency for Chunk-Parallel Linear Attention,arxiv,cs
2026-06-26,https://arxiv.org/abs/2606.27233,Bridging Talk and Thought: Understanding Dialogue Dynamics Across Collaborative Problem-Solving Contexts,arxiv,cs
2026-06-26,https://arxiv.org/abs/2606.27234,"From Celebrities to Anyone: Characterizing AI Nudification Content, Technology, and Community Dynamics on 4chan",arxiv,cs
2026-06-26,https://arxiv.org/abs/2606.27239,HumanoidUMI: Bridging Robot-Free Demonstrations and Humanoid Whole-Body Manipulation,arxiv,cs
2026-06-26,https://arxiv.org/abs/2606.27246,Effective Covariance Dynamics in Solvable High-Dimensional GANs,arxiv,cs
2026-06-26,https://arxiv.org/abs/2606.27247,RSPC: A Benchmark for Modeling Stress and Psychiatric Conditions in Digitally Mediated Relationships using Psychiatrist Annotations,arxiv,cs
2026-06-26,https://arxiv.org/abs/2606.27251,Advancing Omnimodal Embodied Agents from Isolated Skills to Everyday Physical Autonomy,arxiv,cs
2026-06-26,https://arxiv.org/abs/2606.27257,Resilient Output Containment under Undisclosed Leader Dynamics and Actuator Attacks,arxiv,cs
2026-06-26,https://arxiv.org/abs/2606.27268,E-TTS: A New Embodied Test-Time Scaling Framework for Robotic Manipulation,arxiv,cs
2026-06-26,https://arxiv.org/abs/2606.27274,BetXplain: An Explanation-Annotated Dataset for Detecting Manipulative Betting Advertisements on Social Media,arxiv,cs
2026-06-26,https://arxiv.org/abs/2606.27277,EO-WM: A Physically Informed World Model for Probabilistic Earth Observation Forecasting,arxiv,cs
2026-06-26,https://arxiv.org/abs/2606.27282,How Good Can Linear Models Be for Time-Series Forecasting?,arxiv,cs
2026-06-26,https://arxiv.org/abs/2606.27285,Recovering Governing Equations from Solution Data: Identifiability Bounds for Linear and Nonlinear ODEs,arxiv,cs
2026-06-26,https://arxiv.org/abs/2606.27286,Simulation-based inference for rapid Bayesian parameter estimation in epidemiological models: a comparison with MCMC,arxiv,cs
2026-06-26,https://arxiv.org/abs/2606.27287,Prompt Injection in Automated R\'esum\'e Screening with Large Language Models: Single and Multi-Injection Settings,arxiv,cs
2026-06-26,https://arxiv.org/abs/2606.27288,"When Does Combining Language Models Help? A Co-Failure Ceiling on Routing, Voting, and Mixture-of-Agents Across 67 Frontier Models",arxiv,cs
2026-06-26,https://arxiv.org/abs/2606.27291,Designing Reward Signals for Portable Query Generation: A Case Study in Industrial Semantic Job Search,arxiv,cs
2026-06-26,https://arxiv.org/abs/2606.27292,BOWConnect: Parallel Bayesian Optimization over Windows with Learned Local Cost Maps for Sample-Efficient Kinodynamic Motion Planning,arxiv,cs
2026-06-26,https://arxiv.org/abs/2606.27294,Generative Models on Analog Hardware with Dynamics,arxiv,cs
2026-06-26,https://arxiv.org/abs/2606.27295,LA4VLA: Learning to Act without Seeing via Language-Action Pretraining,arxiv,cs
2026-06-26,https://arxiv.org/abs/2606.27302,AI Healthcare Chatbots as Information Infrastructure: A Large-Scale Study of User-Reported Breakdowns,arxiv,cs
2026-06-26,https://arxiv.org/abs/2606.27304,A Multi-Fidelity Convolutional Autoencoder-Transfer Learning Framework for Guided-Wave-Based Damage Diagnosis Using Large Simulated and Limited Experimental Datasets,arxiv,cs
2026-06-26,https://arxiv.org/abs/2606.27315,Blackwell Approachability and Gradient Equilibrium are Equivalent,arxiv,cs
2026-06-26,https://arxiv.org/abs/2606.27317,OctoSense: Self-Supervised Learning for Multimodal Robot Perception,arxiv,cs
2026-06-26,https://arxiv.org/abs/2606.27321,Beyond the Hard Budget: Sparsity Regularizers for More Interpretable Top-k Sparse Autoencoders,arxiv,cs
2026-06-26,https://arxiv.org/abs/2606.27326,Hallucination in World Models is Predictable and Preventable,arxiv,cs
2026-06-26,https://arxiv.org/abs/2606.27330,Empowering GUI Agents via Autonomous Experience Exploration and Hindsight Experience Utilization for Task Planning,arxiv,cs
2026-06-26,https://arxiv.org/abs/2606.27334,Language-Based Digital Twins for Elderly Cognitive Assistance,arxiv,cs
2026-06-26,https://arxiv.org/abs/2606.27342,Understanding Domain-Aware Distribution Alignment in Budgeted Entity Matching,arxiv,cs
2026-06-26,https://arxiv.org/abs/2606.27344,VibeAct: Vibration to Actions for Contact-Rich Reactive Robot Dexterity,arxiv,cs
2026-06-26,https://arxiv.org/abs/2606.27348,Bridging Performance and Generalization in Reinforcement Learning for Agile Flight,arxiv,cs
2026-06-26,https://arxiv.org/abs/2606.27353,Continual Robot Policy Learning via Variational Neural Dynamics,arxiv,cs
2026-06-26,https://arxiv.org/abs/2606.27354,Error-Conditioned Neural Solvers,arxiv,cs
2026-06-26,https://arxiv.org/abs/2606.27355,RouterVLA: Turning Smoke Tests into Supervision for Heterogeneous VLA Selection,arxiv,cs
2026-06-26,https://arxiv.org/abs/2606.27361,Autoregressive Boltzmann Generators,arxiv,cs
2026-06-26,https://arxiv.org/abs/2606.27369,Reinforcement Learning without Ground-Truth Solutions can Improve LLMs,arxiv,cs
2026-06-26,https://arxiv.org/abs/2606.27374,World Action Models Enable Continual Imitation Learning with Recurrent Generative Replays,arxiv,cs
2026-06-26,https://arxiv.org/abs/2606.27375,"Scalable Behavior Cloning with Open Data, Training, and Evaluation",arxiv,cs
2026-06-26,https://arxiv.org/abs/2606.27377,DanceOPD: On-Policy Generative Field Distillation,arxiv,cs
2026-06-26,https://arxiv.org/abs/2311.16898,On the existence of optimal multi-valued decoders and their accuracy bounds for ill-posed inverse problems,arxiv,math
2026-06-26,https://arxiv.org/abs/2410.22826,Distributionally Robust Linear Quadratic Gaussian Regulator with Stationary Distributions,arxiv,math
2026-06-26,https://arxiv.org/abs/2411.15121,Information geometric regularization of unidimensional pressureless Euler equations yields global strong solutions,arxiv,math
2026-06-26,https://arxiv.org/abs/2506.04815,A robust approach to sigma point Kalman filtering,arxiv,math
2026-06-26,https://arxiv.org/abs/2507.00853,Ranking Quantilized Mean-Field Games with an Application to Early-Stage Venture Investments,arxiv,math
2026-06-26,https://arxiv.org/abs/2507.08595,Warm-starting outer approximation for parameterized convex MINLP,arxiv,math
2026-06-26,https://arxiv.org/abs/2508.08702,Solving the Market Split Problem with Lattice Enumeration,arxiv,math
2026-06-26,https://arxiv.org/abs/2510.10229,Average Kernel Sizes -- Computable Sharp Accuracy Bounds for Inverse Problems,arxiv,math
2026-06-26,https://arxiv.org/abs/2511.07431,Optimal Cash Transfers and Microinsurance to Reduce Social Protection Costs,arxiv,math
2026-06-26,https://arxiv.org/abs/2512.14072,Monge solutions and uniqueness in multi-marginal optimal transport with hierarchical jumps,arxiv,math
2026-06-26,https://arxiv.org/abs/2601.14024,Performance enhancing of hybrid quantum-classical Benders approach for MILP optimization,arxiv,math
2026-06-26,https://arxiv.org/abs/2601.18969,A Local Discontinuous Galerkin Method for Dirichlet Boundary Control Problems,arxiv,math
2026-06-26,https://arxiv.org/abs/2602.09285,Submodularity of the expected information gain in infinite-dimensional linear inverse problems,arxiv,math
2026-06-26,https://arxiv.org/abs/2603.16573,Preconditioned Proximal Gradient Methods with Conjugate Momentum: A Subspace Perspective,arxiv,math
2026-06-26,https://arxiv.org/abs/2603.17376,A Cycle-Based Solvability Condition for Real Power Flow Equations,arxiv,math
2026-06-26,https://arxiv.org/abs/2605.23589,Unlocking the Informational Value of Marginal Costs for Exact Time Series Aggregation in Generation Expansion Planning,arxiv,math
2026-06-26,https://arxiv.org/abs/2606.26206,Higher-Order vs. Quadratic Binary Optimization: Which Is Better for Probability Optimization with Tensor Sampling?,arxiv,math
2026-06-26,https://arxiv.org/abs/2606.26446,Input Convex Neural Network as a Surrogate in Stability-Constrained Optimization for IBR-dominated Power Systems,arxiv,math
2026-06-26,https://arxiv.org/abs/2606.26482,Minkowski-Type Wasserstein Metrics and Barycenters for Location-Scale Mixtures with Application to Domain Adaptation,arxiv,math
2026-06-26,https://arxiv.org/abs/2606.26544,Maximizing Throughput in an M/G/1 Queue with Customer Abandonments,arxiv,math
2026-06-26,https://arxiv.org/abs/2606.26591,Three-Objective Integral R2 Subset Selection: NP-Hardness and Submodular Approximation,arxiv,math
2026-06-26,https://arxiv.org/abs/2606.26648,Comparative Analysis of Linear Battery Models for Carbon Emission Optimization in Solar Energy Systems,arxiv,math
2026-06-26,https://arxiv.org/abs/2606.26714,Random Walk on B\'ezier Curves for Global Optimization,arxiv,math
2026-06-26,https://arxiv.org/abs/2606.26739,Sinkhorn-Knopp balancing with generalised martingale-type constraints,arxiv,math
2026-06-26,https://arxiv.org/abs/2606.26765,On-Demand Service Zone Design for Energy-Constrained Spatial Queueing Systems,arxiv,math
2026-06-26,https://arxiv.org/abs/2606.26792,"Second-order Methods for Multiobjective Composite Optimization: Preconditioning Strategies, Subspace Variants and Inexact Solutions",arxiv,math
2026-06-26,https://arxiv.org/abs/2606.26853,Numerical analysis of first-order mean field games under displacement monotonicity,arxiv,math
2026-06-26,https://arxiv.org/abs/2606.26897,"Separation, Constraint Qualifications, and Cycling in Outer Approximation",arxiv,math
2026-06-26,https://arxiv.org/abs/2606.26919,"The parental parsimony problem on binary, tree-child phylogenetic networks",arxiv,math
2026-06-26,https://arxiv.org/abs/2606.27150,Endogenous Reinsurance Pricing in Large Competitive Insurance Markets: Finite-Player and Mean Field Analysis,arxiv,math
2026-06-26,https://arxiv.org/abs/2606.27181,Numerical Approximation for Path-Dependent McKean-Vlasov Control with Non-Asymptotic Error Estimates,arxiv,math
2026-06-26,https://arxiv.org/abs/2606.27189,Benign Landscape of Quadratic Programs with Orthogonality Constraints and Its Application to Heteroscedastic Probabilistic PCA,arxiv,math
2026-06-26,https://arxiv.org/abs/2606.27196,Optimizing Accessibility and Maximum Travel Times in Transit Networks: The Hub Covering Location Problem,arxiv,math
2026-06-26,https://arxiv.org/abs/2606.27217,CHAMB-GA: A Containerized HPC Scalable Microservice-Based Framework for Genetic Algorithms,arxiv,math
2026-06-26,https://arxiv.org/abs/2606.27260,Conjecture About Arbitrary Even-Order Convexity of $w$-Optimization of the Split CIF,arxiv,math
2026-06-26,https://arxiv.org/abs/2606.27312,A Verification Theorem for an Optimal Control Problem Governed by the Convective Brinkman--Forchheimer Equations,arxiv,math
2026-06-26,https://huggingface.co/papers/2606.24775,Are We Ready For An Agent-Native Memory System? (89▲),huggingface,
2026-06-26,https://huggingface.co/papers/2606.26058,DomainShuttle: Freeform Open Domain Subject-driven Text-to-video Generation (53▲),huggingface,
2026-06-26,https://huggingface.co/papers/2606.25041,Wan-Streamer v0.1: End-to-end Real-time Interactive Foundation Models (42▲),huggingface,
2026-06-26,https://huggingface.co/papers/2606.25763,ShutterMuse: Capture-Time Photography Guidance with MLLMs (36▲),huggingface,
2026-06-26,https://huggingface.co/papers/2606.25331,Improved Large Language Diffusion Models (32▲),huggingface,
2026-06-26,https://huggingface.co/papers/2606.15932,Beyond NL2Code: A Structured Survey of Multimodal Code Intelligence (27▲),huggingface,
2026-06-26,https://huggingface.co/papers/2606.26087,MVTrack4Gen: Multi-View Point Tracking as Geometric Supervision for 4D Video Generation (26▲),huggingface,
2026-06-26,https://huggingface.co/papers/2606.21661,UnityShots: Memory-Driven Multi-Shot Audio-Video Generation with Boundary-Aware Gating (19▲),huggingface,
2026-06-26,https://huggingface.co/papers/2606.25319,V-Zero: Answer-Label-Free On-Policy Distillation with Contrastive Evidence Gating for Fine-Grained Visual Reasoning (19▲),huggingface,
2026-06-26,https://huggingface.co/papers/2606.25473,Causal-rCM: A Unified Teacher-Forcing and Self-Forcing Open Recipe for Autoregressive Diffusion Distillation in Streaming Video Generation and Interactive World Models (17▲),huggingface,
2026-06-26,https://huggingface.co/papers/2606.24849,IV-CoT: Implicit Visual Chain-of-Thought for Structure-Aware Text-to-Image Generation (14▲),huggingface,
2026-06-26,https://huggingface.co/papers/2606.18239,EBench: Elemental Diagnosis of Generalist Mobile Manipulation Policies (14▲),huggingface,
2026-06-27,https://huggingface.co/papers/2606.27377,DanceOPD: On-Policy Generative Field Distillation (54▲),huggingface,
2026-06-27,https://huggingface.co/papers/2606.27313,ViQ: Text-Aligned Visual Quantized Representations at Any Resolution (36▲),huggingface,
2026-06-27,https://huggingface.co/papers/2606.26790,OPID: On-Policy Skill Distillation for Agentic Reinforcement Learning (35▲),huggingface,
2026-06-27,https://huggingface.co/papers/2606.26907,Qwen-Image-Agent: Bridging the Context Gap in Real-World Image Generation (34▲),huggingface,
2026-06-27,https://huggingface.co/papers/2606.26300,The Verification Horizon: No Silver Bullet for Coding Agent Rewards (33▲),huggingface,
2026-06-27,https://huggingface.co/papers/2606.18394,JetSpec: Breaking the Scaling Ceiling of Speculative Decoding with Parallel Tree Drafting (24▲),huggingface,
2026-06-27,https://huggingface.co/papers/2606.24551,GUI vs. CLI: Execution Bottlenecks in Screen-Only and Skill-Mediated Computer-Use Agents (23▲),huggingface,
2026-06-27,https://huggingface.co/papers/2606.26217,Fast LeWorldModel (16▲),huggingface,
2026-06-27,https://huggingface.co/papers/2606.26027,Why Multi-Step Tool-Use Reinforcement Learning Collapses and How Supervisory Signals Fix It (12▲),huggingface,
2026-06-27,https://huggingface.co/papers/2606.14397,Running the Gauntlet: Re-evaluating the Capabilities of Agents Beyond Familiar Environments (11▲),huggingface,
2026-06-27,https://huggingface.co/papers/2606.27192,LISA: Likelihood Score Alignment for Visual-condition Controllable Generation (10▲),huggingface,
2026-06-27,https://huggingface.co/papers/2606.26904,Confidence-Aware Tool Orchestration for Robust Video Understanding (8▲),huggingface,
2026-06-29,https://arxiv.org/abs/2102.09235,Deep Residual Networks Learn the Geodesic Curve in the Wasserstein Space,arxiv,stat
2026-06-29,https://arxiv.org/abs/2402.11736,Monte Carlo with kernel-based Gibbs measures: Guarantees for probabilistic herding,arxiv,stat
2026-06-29,https://arxiv.org/abs/2405.19466,Active Exploration via Autoregressive Generation of Missing Data,arxiv,stat
2026-06-29,https://arxiv.org/abs/2412.20802,Towards Reliable Recommender Systems for Rating Data,arxiv,stat
2026-06-29,https://arxiv.org/abs/2501.07400,Derivation of effective gradient flow equations and dynamical truncation of training data in Deep Learning,arxiv,stat
2026-06-29,https://arxiv.org/abs/2502.00168,Supervised Quadratic Feature Analysis: Information Geometry Approach for Dimensionality Reduction,arxiv,stat
2026-06-29,https://arxiv.org/abs/2502.06577,The Minimal Search Space for Conditional Causal Bandits,arxiv,stat
2026-06-29,https://arxiv.org/abs/2503.09736,Tilted sensitivity analysis in matched observational studies,arxiv,stat
2026-06-29,https://arxiv.org/abs/2503.13051,Permutation Learning with Only N Parameters: From SoftSort to Self-Organizing Gaussians,arxiv,stat
2026-06-29,https://arxiv.org/abs/2505.13809,Semiparametric Off-Policy Inference for Optimal Policy Values under Possible Non-Uniqueness,arxiv,stat
2026-06-29,https://arxiv.org/abs/2506.13139,Random Matrix Theory for Deep Learning: Beyond Eigenvalues of Linear Models,arxiv,stat
2026-06-29,https://arxiv.org/abs/2507.17831,On Focusing Statistical Power for Searches and Measurements in Particle Physics,arxiv,stat
2026-06-29,https://arxiv.org/abs/2508.01392,Quenched large deviations for Monte Carlo integration with Coulomb gases,arxiv,stat
2026-06-29,https://arxiv.org/abs/2509.01924,Non-Linear Model-Based Sequential Decision-Making in Agriculture,arxiv,stat
2026-06-29,https://arxiv.org/abs/2509.18580,A Cumulative Ordered Spike-and-Slab Prior for Adaptive Dimension Selection in Joint Latent Space Models,arxiv,stat
2026-06-29,https://arxiv.org/abs/2510.17994,Assessing Monotone Dependence: Area Under the Curve Meets Rank Correlation,arxiv,stat
2026-06-29,https://arxiv.org/abs/2510.24187,Self-Concordant Perturbations for Linear Bandits,arxiv,stat
2026-06-29,https://arxiv.org/abs/2512.23075,Trust Region Masking for Long-Horizon LLM Reinforcement Learning,arxiv,stat
2026-06-29,https://arxiv.org/abs/2602.09456,Taming the Monster Every Context: Complexity Measure and Unified Framework for Offline-Oracle Efficient Contextual Bandits,arxiv,stat
2026-06-29,https://arxiv.org/abs/2602.10714,A Non-asymptotic Analysis for Learning and Applying a Preconditioner in MCMC,arxiv,stat
2026-06-29,https://arxiv.org/abs/2602.16065,Can Generative Artificial Intelligence Survive Data Contamination? Theoretical Guarantees under Contaminated Recursive Training,arxiv,stat
2026-06-29,https://arxiv.org/abs/2603.02502,Tree-Embedded Bayesian Factor Models for Multidimensional Categorical Distributions,arxiv,stat
2026-06-29,https://arxiv.org/abs/2603.11229,Trustworthy Predictive Distributions for Tail Events with Semiparametric Diagnostic Transport Maps,arxiv,stat
2026-06-29,https://arxiv.org/abs/2603.17381,An Auditable AI Agent Loop for Empirical Economics: A Case Study in Forecast Combination,arxiv,stat
2026-06-29,https://arxiv.org/abs/2604.24969,Network-aware IV Regression for Causal Node Discovery and Estimation,arxiv,stat
2026-06-29,https://arxiv.org/abs/2605.14762,Differentially private inference framework for Riemannian manifold data,arxiv,stat
2026-06-29,https://arxiv.org/abs/2606.05450,Eigenvector Spatial Filters Nuclear Norm Matrix Completion with Application to Air Quality Data,arxiv,stat
2026-06-29,https://arxiv.org/abs/2606.11347,Annealed Entropic Allocation for Ranking and Selection,arxiv,stat
2026-06-29,https://arxiv.org/abs/2606.11865,Conformal Bayes under Label Shift: Post-Hoc Calibration vs. In-Training Adaptation,arxiv,stat
2026-06-29,https://arxiv.org/abs/2606.27455,Directed Graph Topology Inference via Graph Filter Identification,arxiv,stat
2026-06-29,https://arxiv.org/abs/2606.27462,The Decision Geometry of Covariance Estimation for the Global Minimum-Variance Portfolio under Heavy Tails,arxiv,stat
2026-06-29,https://arxiv.org/abs/2606.27518,Causal Inference for Functional Treatments with Stochastic Policies,arxiv,stat
2026-06-29,https://arxiv.org/abs/2606.27614,Structural Change Detection in Dynamic Systems,arxiv,stat
2026-06-29,https://arxiv.org/abs/2606.27638,Fast Approximate MM-Estimation for Outlier Robust Model Selection,arxiv,stat
2026-06-29,https://arxiv.org/abs/2606.27654,Modeling Educational Performance Using School Demographics and Teacher Characteristics,arxiv,stat
2026-06-29,https://arxiv.org/abs/2606.27662,Design-Aware Variance Reduction for Switchback Experiments: A Comparative Study,arxiv,stat
2026-06-29,https://arxiv.org/abs/2606.27685,Adversarial Contamination Meets Hard Thresholding: An Iterative Algorithm with Signal Adaptivity and Minimax Optimality,arxiv,stat
2026-06-29,https://arxiv.org/abs/2606.27789,Robust and Scalable Sure Screening of Fixed effects in Ultrahigh-dimensional Linear Mixed Models,arxiv,stat
2026-06-29,https://arxiv.org/abs/2606.27952,Robust estimation of occupation probabilities for coarsened multistate processes,arxiv,stat
2026-06-29,https://arxiv.org/abs/2606.27954,Local Fokker--Planck Geometry for Score Estimation: Heat-Ball Mean-Value Representations and Exact High-Dimensional Sampling,arxiv,stat
2026-06-29,https://arxiv.org/abs/2606.27971,A beta-binomial model respecting randomization and its comparison to the standard beta-binomial model that ignores randomization for the meta-analysis of rare events,arxiv,stat
2026-06-29,https://arxiv.org/abs/2606.27997,Benchmarking on Tasks That Matter: Dataset Selection for Preserving Model Rankings,arxiv,stat
2026-06-29,https://arxiv.org/abs/2606.28015,Bayesian Simultaneous Credible Bands for Polynomial Regression,arxiv,stat
2026-06-29,https://arxiv.org/abs/2606.28017,A Toolkit for the Study of Treatment-Effect Discontinuities,arxiv,stat
2026-06-29,https://arxiv.org/abs/2606.28033,A joint meta-analysis framework for the accuracy of two diagnostic tests accounting for varying study designs,arxiv,stat
