date,url,title,source,category
2026-07-15,https://arxiv.org/abs/2607.12747,Tracing Agentic Failure from the Flow of Success,arxiv,cs
2026-07-15,https://arxiv.org/abs/2607.12748,Weakly Supervised Spatio-Temporal Candidate Discovery of Dairy Farm Sites from Seasonal Satellite Imagery,arxiv,cs
2026-07-15,https://arxiv.org/abs/2607.12752,Hallo4D: Multi-Modal Hallucination Mitigation for Consistent Spatio-Temporal Generation,arxiv,cs
2026-07-15,https://arxiv.org/abs/2607.12755,"Practical Judgment, Virtue, and Intuition in the Use of Opaque AI-Enabled Systems",arxiv,cs
2026-07-15,https://arxiv.org/abs/2607.12763,Constraint-Aware Aggregation for Federated Reinforcement Learning in Microgrid Energy Coordination,arxiv,cs
2026-07-15,https://arxiv.org/abs/2607.12767,"Accuracy and Normalized Accuracy under Length Bias: Analysis, Guidelines, and a Bayesian Alternative",arxiv,cs
2026-07-15,https://arxiv.org/abs/2607.12771,Learning Mechanistic Reasoning for Chemical Reactions with Large Language Models,arxiv,cs
2026-07-15,https://arxiv.org/abs/2607.12774,HSEmotion Team at the 11th ABAW Challenge: Multi-Task Learning and Ambivalence/Hesitancy Video Recognition,arxiv,cs
2026-07-15,https://arxiv.org/abs/2607.12775,Learning-enabled Acceleration of Scenario-based Model Predictive Control,arxiv,cs
2026-07-15,https://arxiv.org/abs/2607.12780,When Close Enough Is Not Enough: Autoregressive Drift in Quantum Circuit Synthesis,arxiv,cs
2026-07-15,https://arxiv.org/abs/2607.12784,Directional Constraints for Efficient Exploration in Safe Reinforcement Learning,arxiv,cs
2026-07-15,https://arxiv.org/abs/2607.12787,Do We Really Need Multimodal Emotion Language Models Larger Than 1B Parameters?,arxiv,cs
2026-07-15,https://arxiv.org/abs/2607.12789,AVQ-Attention: Adaptive Vector-Quantized Attention,arxiv,cs
2026-07-15,https://arxiv.org/abs/2607.12790,Who Grades the Grader? Co-Evolving Evaluation Metrics and Skills for Self-Improving LLM Agents,arxiv,cs
2026-07-15,https://arxiv.org/abs/2607.12792,Silent Alarm: A J-Space Protocol for Comparing Danger Recognition Across Models and Quantization Levels,arxiv,cs
2026-07-15,https://arxiv.org/abs/2607.12796,The One-Word Census: Answer-Choice Conformity Across 44 Language Models,arxiv,cs
2026-07-15,https://arxiv.org/abs/2607.12801,Autonomous Tracking and Terminal Guidance of Moving Targets for Fixed-Wing UAVs,arxiv,cs
2026-07-15,https://arxiv.org/abs/2607.12811,PixelLoop: Shortcut Topological Navigation with Pixel-Level Loops,arxiv,cs
2026-07-15,https://arxiv.org/abs/2607.12815,Visual Access Boundaries in Vision-Language Model Reasoning,arxiv,cs
2026-07-15,https://arxiv.org/abs/2607.12823,Human-AI Agent Interaction as a Neuroplastic Training Environment,arxiv,cs
2026-07-15,https://arxiv.org/abs/2607.12826,Solution of the Hempel's statistical ambiguity problem and Causal AI,arxiv,cs
2026-07-15,https://arxiv.org/abs/2607.12829,Accelerating Masked Diffusion Large Language Models: A Survey of Efficient Inference Techniques,arxiv,cs
2026-07-15,https://arxiv.org/abs/2607.12840,Reproducible Reservoir Computing with Thermally Driven Superparamagnets: Controlling Temperature Sensitivity,arxiv,cs
2026-07-15,https://arxiv.org/abs/2607.12856,Verifier-Based Reinforcement Fine-Tuning of Reasoning Models for Thermal Energy Storage Control,arxiv,cs
2026-07-15,https://arxiv.org/abs/2607.12857,ChartGenEval: Corruption-Tested Multi-Dimensional Feedback for Rhythm-Game Chart Generation,arxiv,cs
2026-07-15,https://arxiv.org/abs/2607.12861,Unveiling Complex Collective Behaviors from Simple Rewards,arxiv,cs
2026-07-15,https://arxiv.org/abs/2607.12863,Toward Localizing and Repairing Bias in Transformer Attention Heads,arxiv,cs
2026-07-15,https://arxiv.org/abs/2607.12868,Deep4ge: DNN Training Trajectories for Fault Detection and Diagnosis,arxiv,cs
2026-07-15,https://arxiv.org/abs/2607.12875,MetaInfer: A Knowledge Only LLM Inference Engine Generator SKILL Toolbox,arxiv,cs
2026-07-15,https://arxiv.org/abs/2607.12886,"A Multi-Agent System for Autonomous, Fine-Tuning-Free Clinical Symptom Detection: Development and Validation Study",arxiv,cs
2026-07-15,https://arxiv.org/abs/2607.12888,Energy-Based Physics-Informed Form Finding for Clustered Tensegrity Structures,arxiv,cs
2026-07-15,https://arxiv.org/abs/2607.12892,UR-VC: Unsupervised Robotic Value Correction for Time-Derived Progress Proxies,arxiv,cs
2026-07-15,https://arxiv.org/abs/2607.12893,MemOps: Benchmarking Lifecycle Memory Operations in Long-Horizon Conversations,arxiv,cs
2026-07-15,https://arxiv.org/abs/2607.12909,Real-time fall detection based on vision for low-power edge platforms,arxiv,cs
2026-07-15,https://arxiv.org/abs/2607.12916,Contrastive-Collapsed Loss for Flexible and Geometrically Optimal Embeddings and Faster Convergence,arxiv,cs
2026-07-15,https://arxiv.org/abs/2607.12924,Knowledge- and Gradient-Guided Reinforcement Learning for Parametrized Action Markov Decision Processes,arxiv,cs
2026-07-15,https://arxiv.org/abs/2607.12928,Efficient Sequential Calibration with $O(T^{2/3-\epsilon})$ Error Bound,arxiv,cs
2026-07-15,https://arxiv.org/abs/2607.12931,ExToken: Structured Exploration for Efficient Vision-Language-Action Reinforcement Fine-tuning,arxiv,cs
2026-07-15,https://arxiv.org/abs/2607.12946,ViHoRec: A Quality-Controlled Vietnamese Hotel Recommendation Dataset and Cold-Start Benchmark,arxiv,cs
2026-07-15,https://arxiv.org/abs/2607.12954,Robustness of Deep Learning Models for PV Power Forecasting under NWP Forecast Errors: A Spatiotemporal and Physically Interpretable Analysis,arxiv,cs
2026-07-15,https://arxiv.org/abs/2607.12962,"Form, Not Content? A Preregistered, Placebo-Controlled Evaluation of Learned Error-Conditioned Self-Repair Through Prompts and Weights in Frozen Small Code Models",arxiv,cs
2026-07-15,https://arxiv.org/abs/2607.12965,MAMMOTH: A Multi-Modal End-to-End Policy for Off-Road Mobility Robust to Missing Modality,arxiv,cs
2026-07-15,https://arxiv.org/abs/2607.12982,FormalAnalyticGeo: A Neural-Symbolic Based Framework for Multimodal Analytic Geometry Problem Generation,arxiv,cs
2026-07-15,https://arxiv.org/abs/2607.12985,Resist and Update: Counterfactual Report Coordinates for Incentive-Compatible LLMs,arxiv,cs
2026-07-15,https://arxiv.org/abs/2607.12986,"Win by Silence: Deletion Non-Monotonicity, Autonomous Exploitation, and Typed-State Gating in LLM Plan Evaluation",arxiv,cs
2026-07-15,https://arxiv.org/abs/2607.12992,ChunkFlow: Towards Continuity-Consistent Chunked Policy Learning,arxiv,cs
2026-07-15,https://arxiv.org/abs/2607.13003,Watermark Forensics for Generative Models: An Information-Theoretic Perspective,arxiv,cs
2026-07-15,https://arxiv.org/abs/2607.13006,The Spectrum Is Not Enough: When Context Helps Time-Series Forecasting,arxiv,cs
2026-07-15,https://arxiv.org/abs/2607.13007,Arxiv Paper 2607.13007,arxiv,cs
2026-07-15,https://arxiv.org/abs/2607.13013,Arxiv Paper 2607.13013,arxiv,cs
2026-07-15,https://arxiv.org/abs/2607.13015,Arxiv Paper 2607.13015,arxiv,cs
2026-07-15,https://arxiv.org/abs/2607.13017,FlowWAM: Optical Flow as a Unified Action Representation for World Action Models,arxiv,cs
2026-07-15,https://arxiv.org/abs/2607.13022,Arxiv Paper 2607.13022,arxiv,cs
2026-07-15,https://arxiv.org/abs/2607.13027,PalmClaw: A Native On-Device Agent Framework for Mobile Phones,arxiv,cs
2026-07-15,https://arxiv.org/abs/2607.13028,TerraZero: Procedural Driving Simulation for Zero-Demonstration Self-Play at Scale,arxiv,cs
2026-07-15,https://arxiv.org/abs/2607.13031,The Seriality Gap in Video Diffusion Models,arxiv,cs
2026-07-15,https://arxiv.org/abs/2607.13033,DenseReward: Dense Reward Learning via Failure Synthesis for Robotic Manipulation,arxiv,cs
2026-07-15,https://arxiv.org/abs/2607.13034,Arxiv Paper 2607.13034,arxiv,cs
2026-07-15,https://arxiv.org/abs/2212.05317,On a Merton Problem with Irreversible Healthcare Investment,arxiv,math
2026-07-15,https://arxiv.org/abs/2404.07125,Strengthened Complex Moment Hierarchies and Finite Convergence over Spheres,arxiv,math
2026-07-15,https://arxiv.org/abs/2509.11890,An Inexact Tensor-Train Primal-Dual Interior-Point Method for Semidefinite Programs,arxiv,math
2026-07-15,https://arxiv.org/abs/2510.16680,HNAG$^{++}$: An Accelerated Gradient Method with a Refined Asymptotic Rate for Strongly Convex Optimization,arxiv,math
2026-07-15,https://arxiv.org/abs/2510.24544,A Two-step Krasnosel'skii-Mann Algorithm with Adaptive Momentum and Its Applications to Image Denoising and Matrix Completion,arxiv,math
2026-07-15,https://arxiv.org/abs/2511.00623,Adaptive Federated Learning to Optimize Integrated Flows in Cyber-Physical Data Centers,arxiv,math
2026-07-15,https://arxiv.org/abs/2512.19201,Mean-field optimal control with stochastic leaders,arxiv,math
2026-07-15,https://arxiv.org/abs/2602.17845,A Refinement in \v{C}ech Cohomology of Coron's Necessary Condition,arxiv,math
2026-07-15,https://arxiv.org/abs/2602.22608,Lower Bounds for Linear Minimization Oracle Methods Optimizing over Strongly Convex Sets,arxiv,math
2026-07-15,https://arxiv.org/abs/2603.17105,Quantitative asymptotic regularity and $T$-asymptotic regularity for the inexact generalized Halpern iteration,arxiv,math
2026-07-15,https://arxiv.org/abs/2604.03475,Scheduling Electricity Production Units to Mitigate Severe Weather Impact: An Efficient Computational Implementation,arxiv,math
2026-07-15,https://arxiv.org/abs/2604.16668,Distance characteristics for incremental quantities,arxiv,math
2026-07-15,https://arxiv.org/abs/2605.14320,Adaptive Metrics for Norm-Minimization-Based Outer Approximation in Convex Vector Optimization,arxiv,math
2026-07-15,https://arxiv.org/abs/2607.11907,A Non-Commutative Voronovskaya Theorem for Quantum Neural Network Operators,arxiv,math
2026-07-15,https://arxiv.org/abs/2607.12109,Exact Solutions to a Class of Constrained Optimal Control Problems via Lossless Convexification for Digital Control,arxiv,math
2026-07-15,https://arxiv.org/abs/2607.12116,Body-fitted tracking of 2d open curves with a level set based mesh evolution method,arxiv,math
2026-07-15,https://arxiv.org/abs/2607.12134,The Certification Limits of KS-Type Layer Relaxations: A Square-Root Ceiling and Its Breakdown,arxiv,math
2026-07-15,https://arxiv.org/abs/2607.12198,Designing Hierarchical Hub-and-Spoke Drone-Based Networks for Delivering Time-Sensitive Healthcare Items,arxiv,math
2026-07-15,https://arxiv.org/abs/2607.12201,Revisiting Simultaneous Methods for Dynamic Optimization in the GPU Era,arxiv,math
2026-07-15,https://arxiv.org/abs/2607.12286,"Structured Preconditioning in Affine-Invariant Geometry: Projection, Certificates, and Kronecker Separation",arxiv,math
2026-07-15,https://arxiv.org/abs/2607.12318,An adaptive interior-point method with backtracking line search for convex constrained optimization,arxiv,math
2026-07-15,https://arxiv.org/abs/2607.12413,Control and homogenization of a coupled hyperbolic system with an oscillating coefficient,arxiv,math
2026-07-15,https://arxiv.org/abs/2607.12456,The regional control of a fractional spatio-temporal SIR model,arxiv,math
2026-07-15,https://arxiv.org/abs/2607.12473,Variable-Lattice-Density Optimization of Pin-Fin Heat Sinks under High-Reynolds-Number Flow Conditions,arxiv,math
2026-07-15,https://arxiv.org/abs/2607.12476,On the Singularity Degree of Shor Relaxations for 0-1 Programs,arxiv,math
2026-07-15,https://arxiv.org/abs/2607.12478,Extension of the safeguarding stepsize interval in Adaptive Gradient Descent,arxiv,math
2026-07-15,https://arxiv.org/abs/2607.12530,Sard property for rank 2 polarizations in metabelian Lie groups,arxiv,math
2026-07-15,https://arxiv.org/abs/2607.12551,Semismooth Newton methods for degenerate polyhedral projection,arxiv,math
2026-07-15,https://arxiv.org/abs/2607.12613,Tensor-Based Reduced-Order Modeling for Optimization-Based Inverse Problems,arxiv,math
2026-07-15,https://arxiv.org/abs/2607.12812,Real and complex stability radii for a class of transport networks,arxiv,math
2026-07-15,https://arxiv.org/abs/2607.12867,Quiz Show Games: Searching with Bimodal Hiding,arxiv,math
2026-07-15,https://arxiv.org/abs/2607.12877,From Manifold Identification to Newton Acceleration on Intersections: Sparse Stiefel Optimization,arxiv,math
2026-07-15,https://arxiv.org/abs/2607.12878,Host-Parasitoid Dynamics and Biological Control of the Sugarcane Borer,arxiv,math
2026-07-15,https://arxiv.org/abs/2607.12942,"Strict complementarity in semidefinite programming, singularity degree, and the (dis)connection of forward and backward errors",arxiv,math
2026-07-15,https://arxiv.org/abs/2607.13029,Online Control via Counterfactual Tracking,arxiv,math
2026-07-15,https://huggingface.co/papers/2607.05394,Weak-to-Strong Generalization via Direct On-Policy Distillation (92▲),huggingface,
2026-07-15,https://huggingface.co/papers/2607.10383,ABot-N1: Toward a General Visual Language Navigation Foundation Model (81▲),huggingface,
2026-07-15,https://huggingface.co/papers/2607.10350,ABot-AgentOS: A General Robotic Agent OS with Lifelong Multi-modal Memory (68▲),huggingface,
2026-07-15,https://huggingface.co/papers/2607.09125,4D Human-Scene Reconstruction from Low-Overlap Captures (41▲),huggingface,
2026-07-15,https://huggingface.co/papers/2607.11487,LightMem-Ego: Your AI Memory for Everyday Life (33▲),huggingface,
2026-07-15,https://huggingface.co/papers/2607.11849,AdvancedMathBench: A Benchmark Suite for Advanced Mathematical Proof Generation and Verification (20▲),huggingface,
2026-07-15,https://huggingface.co/papers/2607.11881,"Metacognition in LLMs: Foundations, Progress, and Opportunities (12▲)",huggingface,
2026-07-15,https://huggingface.co/papers/2607.09701,EgoSteer: A Full-Stack System Towards Steerable Dexterous Manipulation from Egocentric Videos (8▲),huggingface,
2026-07-15,https://huggingface.co/papers/2607.11505,Proxy Exploration and Reusable Guidance: A Modular LLM Post-Training Paradigm via Proxy-Guided Update Signals (7▲),huggingface,
2026-07-15,https://huggingface.co/papers/2607.00397,NeuroCogMap Reveals Cognitive Organization of Large Language Models (5▲),huggingface,
2026-07-15,https://huggingface.co/papers/2607.11736,MET: Theory-Grounded and Culture-Aware Multilingual Moral Reasoning (5▲),huggingface,
2026-07-15,https://huggingface.co/papers/2607.09362,CtrlVTON: Controllable Virtual Try-On via Visual-Instance-Prompt Segmentation (4▲),huggingface,
2026-07-16,https://arxiv.org/abs/2403.13750,Data integration of non-probability and probability samples with deterministic predictive mean matching,arxiv,stat
2026-07-16,https://arxiv.org/abs/2501.10898,High-dimensional Sobolev tests on hyperspheres,arxiv,stat
2026-07-16,https://arxiv.org/abs/2501.11996,Experimental Designs for Multi-Item Multi-Period Inventory Control,arxiv,stat
2026-07-16,https://arxiv.org/abs/2506.21306,Uniform Approximation of Functions with Asymmetric Growth and Decay by Deep Weighted Polynomials,arxiv,stat
2026-07-16,https://arxiv.org/abs/2507.09473,"Efficiency, Feasibility, and Incentive-Awareness in Constrained Online Resource Allocation",arxiv,stat
2026-07-16,https://arxiv.org/abs/2509.14028,Formalising Sample Size Calculations for the Development of Risk Prediction Models: The Importance of Accounting for Performance Variability,arxiv,stat
2026-07-16,https://arxiv.org/abs/2510.15824,Adaptive Conformal Inference through the Lens of Blackwell Approachability,arxiv,stat
2026-07-16,https://arxiv.org/abs/2510.19283,Error Analysis of Triangular Optimal Transport Maps for Filtering,arxiv,stat
2026-07-16,https://arxiv.org/abs/2511.09542,Local Interaction Autoregressive Model for High Dimension Time Series Data,arxiv,stat
2026-07-16,https://arxiv.org/abs/2512.00296,Difference-in-differences with stochastic policy shifts of a continuous treatment,arxiv,stat
2026-07-16,https://arxiv.org/abs/2512.20280,The post-hoc test for local dependence,arxiv,stat
2026-07-16,https://arxiv.org/abs/2601.20496,Leveraging Differentiable PDE Solvers for Semi-Neural Spatial Reconstruction From Sparse Measurements,arxiv,stat
2026-07-16,https://arxiv.org/abs/2602.10691,Convergence Rates for Distribution Matching with Sliced Optimal Transport,arxiv,stat
2026-07-16,https://arxiv.org/abs/2603.14984,Spatiotemporally Consistent Multivariate Bias Correction for Climate Projections via Nested Vine Copulas,arxiv,stat
2026-07-16,https://arxiv.org/abs/2603.21393,A Generalised Exponentiated Gradient Approach to Enhance Fairness in Binary and Multi-class Classification Tasks,arxiv,stat
2026-07-16,https://arxiv.org/abs/2603.22006,A plug-and-play approach with fast uncertainty quantification for weak lensing mass mapping,arxiv,stat
2026-07-16,https://arxiv.org/abs/2605.03268,Partially Observed Structural Causal Models,arxiv,stat
2026-07-16,https://arxiv.org/abs/2606.10593,Data compression for fast dimension reduction and clustering of high-dimensional discrete data,arxiv,stat
2026-07-16,https://arxiv.org/abs/2606.11283,Fixed-Parameter Tractability of Private Synthetic Data Generation,arxiv,stat
2026-07-16,https://arxiv.org/abs/2607.12579,Arxiv Paper 2607.12579,arxiv,stat
2026-07-16,https://arxiv.org/abs/2607.13046,"What Your Model Threw Away and Why You'll Want It Back: Masking, Fingerprinting, and Privacy from Discarded Geometry",arxiv,stat
2026-07-16,https://arxiv.org/abs/2607.13048,Uncertainty-Aware Sequential Decision Rules for Event-Triggered LLM Invocation in Streaming Systems,arxiv,stat
2026-07-16,https://arxiv.org/abs/2607.13112,Anchored Geodesic Analysis for Multivariate Extremes,arxiv,stat
2026-07-16,https://arxiv.org/abs/2607.13113,Deep Simulation-Based Inference for Inhomogeneous Bivariate Log-Gaussian Cox Processes,arxiv,stat
2026-07-16,https://arxiv.org/abs/2607.13182,Bandwidth-free nonparametric density estimation for grouped data,arxiv,stat
2026-07-16,https://arxiv.org/abs/2607.13185,Arxiv Paper 2607.13185,arxiv,stat
2026-07-16,https://arxiv.org/abs/2607.13197,funFMC: Overlapping Clustering for Functional Data,arxiv,stat
2026-07-16,https://arxiv.org/abs/2607.13243,MCMC Methods for Parameter Inference in Structurally Nonidentifiable Models,arxiv,stat
2026-07-16,https://arxiv.org/abs/2607.13264,Evaluation of Circular Logistic Regression Models with Asymmetric Link Functions,arxiv,stat
2026-07-16,https://arxiv.org/abs/2607.13293,Average Cause-Specific Hazard: A Censoring-Invariant Measure of Event Burden Under Competing Risks,arxiv,stat
2026-07-16,https://arxiv.org/abs/2607.13334,Omitted variable bias sensitivity analysis with clustered treatment assignment,arxiv,stat
2026-07-16,https://arxiv.org/abs/2607.13402,Price of Fairness in Bandits: A Tight Minimax Characterization,arxiv,stat
2026-07-16,https://arxiv.org/abs/2607.13414,Non-Expansive Two-Time-Scale Stochastic Approximation: A Fixed-Schedule One-Quarter Barrier and Bias-Corrected Acceleration,arxiv,stat
2026-07-16,https://arxiv.org/abs/2607.13550,Arxiv Paper 2607.13550,arxiv,stat
2026-07-16,https://arxiv.org/abs/2607.13564,Manipulation testing based on Benford's Law for discrete scores,arxiv,stat
2026-07-16,https://arxiv.org/abs/2607.13602,Analogical Deep Research: Retrieving and Integrating Historical Analogies for Foresight Analysis,arxiv,stat
2026-07-16,https://arxiv.org/abs/2607.13609,"Gauge-Invariant, Parameter-Insensitive Regularization for Potential Recovery from Flow on Directed Graphs",arxiv,stat
2026-07-16,https://arxiv.org/abs/2607.13728,Cluster with Auctions for Vector Search,arxiv,stat
2026-07-16,https://arxiv.org/abs/2607.13731,DAGR: State-Conditioned Goal Representations via Difference-Aware Goal Cross-Attention,arxiv,stat
2026-07-16,https://arxiv.org/abs/2607.13749,Algebraic Representability as the Limiting Regime of Grokking: An Exactly Solvable Model with Holomorphic Activations,arxiv,stat
2026-07-16,https://arxiv.org/abs/2607.13841,Heavy-Tailed Flow Matching via Random Clocks,arxiv,stat
2026-07-16,https://arxiv.org/abs/2607.13850,Bias Correction for Relative Importance Measures via Doubly Stochastic Reallocation,arxiv,stat
2026-07-16,https://arxiv.org/abs/2607.13883,Verifying formulas for interventional distributions,arxiv,stat
2026-07-16,https://arxiv.org/abs/2607.13928,Plausible Deniability Guarantees for Whistleblowers,arxiv,stat
2026-07-16,https://arxiv.org/abs/2607.13984,Arxiv Paper 2607.13984,arxiv,stat
2026-07-16,https://arxiv.org/abs/2607.14064,Minimax Theory of Likelihood-Based Deep Learning for Speckle Regression,arxiv,stat
2026-07-16,https://arxiv.org/abs/2607.14081,Linear Independent Component Analysis via Optimal Transport,arxiv,stat
2026-07-16,https://arxiv.org/abs/2405.17366,Arxiv Paper 2405.17366,arxiv,cs
2026-07-16,https://arxiv.org/abs/2409.17340,Arxiv Paper 2409.17340,arxiv,cs
2026-07-16,https://arxiv.org/abs/2502.07780,Arxiv Paper 2502.07780,arxiv,cs
2026-07-16,https://arxiv.org/abs/2502.13467,Arxiv Paper 2502.13467,arxiv,cs
2026-07-16,https://arxiv.org/abs/2502.16167,Arxiv Paper 2502.16167,arxiv,cs
2026-07-16,https://arxiv.org/abs/2502.19716,Arxiv Paper 2502.19716,arxiv,cs
2026-07-16,https://arxiv.org/abs/2503.24092,Arxiv Paper 2503.24092,arxiv,cs
2026-07-16,https://arxiv.org/abs/2505.14303,Arxiv Paper 2505.14303,arxiv,cs
2026-07-16,https://arxiv.org/abs/2505.18231,Arxiv Paper 2505.18231,arxiv,cs
2026-07-16,https://arxiv.org/abs/2507.16849,Arxiv Paper 2507.16849,arxiv,cs
2026-07-16,https://arxiv.org/abs/2507.19593,Arxiv Paper 2507.19593,arxiv,cs
2026-07-16,https://arxiv.org/abs/2507.23270,Arxiv Paper 2507.23270,arxiv,cs
2026-07-16,https://arxiv.org/abs/2508.12466,Arxiv Paper 2508.12466,arxiv,cs
2026-07-16,https://arxiv.org/abs/2508.16403,Arxiv Paper 2508.16403,arxiv,cs
2026-07-16,https://arxiv.org/abs/2509.08685,Arxiv Paper 2509.08685,arxiv,cs
2026-07-16,https://arxiv.org/abs/2509.10033,Arxiv Paper 2509.10033,arxiv,cs
2026-07-16,https://arxiv.org/abs/2510.01943,Arxiv Paper 2510.01943,arxiv,cs
2026-07-16,https://arxiv.org/abs/2510.04876,Arxiv Paper 2510.04876,arxiv,cs
2026-07-16,https://arxiv.org/abs/2510.10002,Arxiv Paper 2510.10002,arxiv,cs
2026-07-16,https://arxiv.org/abs/2510.11686,Arxiv Paper 2510.11686,arxiv,cs
2026-07-16,https://arxiv.org/abs/2510.12363,Arxiv Paper 2510.12363,arxiv,cs
2026-07-16,https://arxiv.org/abs/2510.13903,Arxiv Paper 2510.13903,arxiv,cs
2026-07-16,https://arxiv.org/abs/2510.14317,Arxiv Paper 2510.14317,arxiv,cs
2026-07-16,https://arxiv.org/abs/2510.14893,Arxiv Paper 2510.14893,arxiv,cs
2026-07-16,https://arxiv.org/abs/2510.15371,Arxiv Paper 2510.15371,arxiv,cs
2026-07-16,https://arxiv.org/abs/2510.24803,Arxiv Paper 2510.24803,arxiv,cs
2026-07-16,https://arxiv.org/abs/2510.26707,Arxiv Paper 2510.26707,arxiv,cs
2026-07-16,https://arxiv.org/abs/2511.01680,Arxiv Paper 2511.01680,arxiv,cs
2026-07-16,https://arxiv.org/abs/2511.11949,Arxiv Paper 2511.11949,arxiv,cs
2026-07-16,https://arxiv.org/abs/2511.13592,Arxiv Paper 2511.13592,arxiv,cs
2026-07-16,https://arxiv.org/abs/2511.18685,Arxiv Paper 2511.18685,arxiv,cs
2026-07-16,https://arxiv.org/abs/2512.18965,Arxiv Paper 2512.18965,arxiv,cs
2026-07-16,https://arxiv.org/abs/2601.02023,Arxiv Paper 2601.02023,arxiv,cs
2026-07-16,https://arxiv.org/abs/2601.04365,Arxiv Paper 2601.04365,arxiv,cs
2026-07-16,https://arxiv.org/abs/2601.10930,Arxiv Paper 2601.10930,arxiv,cs
2026-07-16,https://arxiv.org/abs/2601.12349,Arxiv Paper 2601.12349,arxiv,cs
2026-07-16,https://arxiv.org/abs/2601.18798,Arxiv Paper 2601.18798,arxiv,cs
2026-07-16,https://arxiv.org/abs/2601.20379,Arxiv Paper 2601.20379,arxiv,cs
2026-07-16,https://arxiv.org/abs/2601.22830,Arxiv Paper 2601.22830,arxiv,cs
2026-07-16,https://arxiv.org/abs/2602.02741,Arxiv Paper 2602.02741,arxiv,cs
2026-07-16,https://arxiv.org/abs/2602.09616,Arxiv Paper 2602.09616,arxiv,cs
2026-07-16,https://arxiv.org/abs/2602.11619,Arxiv Paper 2602.11619,arxiv,cs
2026-07-16,https://arxiv.org/abs/2602.12811,Arxiv Paper 2602.12811,arxiv,cs
2026-07-16,https://arxiv.org/abs/2602.17659,Arxiv Paper 2602.17659,arxiv,cs
2026-07-16,https://arxiv.org/abs/2602.19108,Arxiv Paper 2602.19108,arxiv,cs
2026-07-16,https://arxiv.org/abs/2603.00546,Arxiv Paper 2603.00546,arxiv,cs
2026-07-16,https://arxiv.org/abs/2603.03892,Arxiv Paper 2603.03892,arxiv,cs
2026-07-16,https://arxiv.org/abs/2603.04710,Arxiv Paper 2603.04710,arxiv,cs
2026-07-16,https://arxiv.org/abs/2603.08521,Arxiv Paper 2603.08521,arxiv,cs
2026-07-16,https://arxiv.org/abs/2603.10330,Arxiv Paper 2603.10330,arxiv,cs
2026-07-16,https://arxiv.org/abs/2603.11811,Arxiv Paper 2603.11811,arxiv,cs
2026-07-16,https://arxiv.org/abs/2603.12361,Arxiv Paper 2603.12361,arxiv,cs
2026-07-16,https://arxiv.org/abs/2603.12451,Arxiv Paper 2603.12451,arxiv,cs
2026-07-16,https://arxiv.org/abs/2603.12712,Arxiv Paper 2603.12712,arxiv,cs
2026-07-16,https://arxiv.org/abs/2603.13952,Arxiv Paper 2603.13952,arxiv,cs
2026-07-16,https://arxiv.org/abs/2603.14604,Arxiv Paper 2603.14604,arxiv,cs
2026-07-16,https://arxiv.org/abs/2603.14709,Arxiv Paper 2603.14709,arxiv,cs
2026-07-16,https://arxiv.org/abs/2603.19063,Arxiv Paper 2603.19063,arxiv,cs
2026-07-16,https://arxiv.org/abs/2603.22372,Arxiv Paper 2603.22372,arxiv,cs
2026-07-16,https://arxiv.org/abs/2604.00830,Arxiv Paper 2604.00830,arxiv,cs
2026-07-16,https://arxiv.org/abs/2604.02668,Arxiv Paper 2604.02668,arxiv,cs
2026-07-16,https://arxiv.org/abs/2604.06614,Arxiv Paper 2604.06614,arxiv,cs
2026-07-16,https://arxiv.org/abs/2604.09674,Arxiv Paper 2604.09674,arxiv,cs
2026-07-16,https://arxiv.org/abs/2604.12069,Arxiv Paper 2604.12069,arxiv,cs
2026-07-16,https://arxiv.org/abs/2604.21688,Arxiv Paper 2604.21688,arxiv,cs
2026-07-16,https://arxiv.org/abs/2604.23620,Arxiv Paper 2604.23620,arxiv,cs
2026-07-16,https://arxiv.org/abs/2605.07323,Arxiv Paper 2605.07323,arxiv,cs
2026-07-16,https://arxiv.org/abs/2605.07914,Arxiv Paper 2605.07914,arxiv,cs
2026-07-16,https://arxiv.org/abs/2605.13181,Arxiv Paper 2605.13181,arxiv,cs
